660,661,ANLODIN-10 TABLET,B4-6252,AMLODIPINE BESYLATE BP 10MG,TABLET/1X10X10,"CIFAX EXIM LIMITED. 20, MOJIDI STREET, IKEJA, LAGOS NIGERIA","NORRIS MEDICINES LTD PLOT NO. 901/4-5, GIDC ESTATE ANKLESHWAR- 393 002 GUJARAT INDIA ,INDIA",05/04/2016,04/04/2021
661,662,FIBROTIN TABLET,B4-6253,FENOFIBRATE BP 160MG,TABLET/3X10,"GREENLIFE PHARMACEUTICALS LTD. NO 2, BANK LANE, ILUPEJU, LAGOS NIGERIA","BLISS GVS PHARMA LTD 10, DEWAN UDYOG NAGAR, ALIYALI, PALGHAR MAHARASHTRA- 401 404 INDIA ,INDIA",05/04/2016,04/04/2021
662,663,ZINOLYTE COMBIPACK,B4-6254,"ORAL REHYDRATION SALT BP 20.5G, ZINC SULPHATE USP 20MG",POWDER/TABLETS/1 X(2X20.5G+ 2X7'S),"GOLEK PHARM LTD 1, OLABISI CLOSE, MENDE MARYLAND LAGOS","HALEWOOD LABORATORIES PVT LTD PLOT NO. 319, PHASE II, GIDC, VATVA, AHMEDABAD- 382 445, GUJARAT INDIA ,INDIA",05/04/2016,04/04/2021
663,664,ANLODIN-5 TABLET,B4-6255,AMLODIPINE BESYLATE BP 5MG,TABLET/ 1X10X10,"CIFAX EXIM LIMITED CIFAX EXIM LIMITED. 20, MOJIDI STREET, IKEJA, LAGOS NIGERIA","NORRIS MEDICINES LIMITED PLOT NO 901/4-5, GIDC ESTATE, ANKLESHWAR INDIA ,INDIA",05/04/2016,04/04/2021
664,665,RAJCIMETI TABLET,B4-6256,CIMETIDINE BP 400MG,TABLET/1X10,"SEAGREEN PHARMA LTD 3, OKUNFOLAMI STREET, ANTHONY VILLAGE, LAGOS","OSAKA PHARMA PVT LTD OLD NATIONAL HIGHWAY, NO 8, SANKARDA-391 350, DIST. VADODARA, GUJARAT INDIA ,INDIA",05/04/2016,04/04/2021
665,666,VASOFLO 75MG TABLET,B4-6257,ASPIRIN (AS DELAYED RELEASE) USP 75MG,TABLET/ 10X10,"OSBIL NIG LTD 23, BUBA MARWA ROAD, IJEGUN SATELLITE TOWN LAGOS","MEDIBIOS LABORATORIES PVT LTD PLOT NO J-76 MIDC TARAPUR BOISAR, THANE-401 506, MAHARASHTRA INDIA ,INDIA",05/04/2016,04/04/2021
666,667,CETIL 500 TABLET,B4-6258,CEFUROXIME AXETIL USP EQ TO CEFUROXIME 500MG,TABLET/ 1X10,"ONIFAM LABORATORIES LTD SUITE C5 2ND FLOOR AMORI PLAZA, 113 IDIMU ROAD ORELOPE, EGBEDA LAGOS","LUPIN LTD 198- 202, NEW INDUSTRIAL AREA. NO 2, MANDIDEEP- 462 046 DIST. RAISEN (M.P.) INDIA ,INDIA",05/04/2016,04/04/2021
667,668,CETIL 250 TABLET,B4-6259,CEFUROXIME AXETIL USP EQ TO CEFUROXIME 250MG,TABLET/1X10,"ONIFAM LABORATORIES LTD SUITE C5 2ND FLOOR AMORI PLAZA, 113 IDIMU ROAD ORELOPE, EGBEDA LAGOS","LUPIN LTD 198- 202, NEW INDUSTRIAL AREA. NO 2, MANDIDEEP- 462 046 DIST. RAISEN (M.P.) INDIA ,INDIA",05/04/2016,04/04/2021
668,669,PROMEDIX ESCITALOPRAM TABLET,B4-6260,ESCITALOPRAM OXALATE EQ TO ESCITALOPRAM 10MG,TABLET/10X10,PROMEDIX LTD 2 NINKU LINK SECRETARIAT JUNCTION JOS PLATEAU STATE NIGERIA,"PSYCHOTROPICS INDIA LTD PLOT NO. 46 & 49, SECTOR-6A, 11E, SIDCUL RANIPUR, HARIDWAR-249 403 UTTARAKHAND INDIA ,INDIA",05/04/2016,04/04/2021
669,670,ERYTHROMYCIN STEARATE TABLET BP 500MG,B4-6261,ERYTHROMYCIN STEARATE BP EQ TO ERYTHROMYCIN 500MG,TABLET/1X10,"ASSURA PHARMACEUTICALS AND HEALTH PRODUCTS LTD 254, BORNU WAY, ADEKUNLE EBUTE METTA LAGOS NIGERIA","SHINE PHARMACEUTICALS LTD. PLOT NO. 132 JUNI JITHERDI KARJAN-VEMARDI ROAD TA. KARJAN, DIST. VADODARA- 391 240 INDIA ,INDIA",05/04/2016,04/04/2021
670,671,APHAZOLE TABLET,B4-6262,ALBENDAZOLE USP 400MG,TABLET/1X1,"APHANTEE PHARM NIG LTD PACIFIC COMPLEX NO. 9 FIRST FLOOR, SUIT FF 11, AWKA ROAD, ONITSHA NIGERIA","MAXHEAL LABORATORIES PVT LTD 2-7/80-85, SURSEZ, SACHIN DIST. SURAT, GUJARAT-394 230 INDIA ,INDIA",05/04/2016,04/04/2021
671,672,ARTEMETHER 80MG AND LUMEFANTRINE 480MG TABLET,B4-6263,"ARTEMETHER 80MG, LUMEFANTRINE 480MG",TABLET/1X6,"KEN-AVELINKS NIG. LTD SHOP 61/62, TOWA SHOPS JIMETA-YOLA ADAMAWA STATE","ZOTA HEALTHCARE LTD PLOT NO. 169, SURAT SPECIAL ECONOMIC ZONE, SACHIN, SURAT-394 230 (GUJARAT) INDIA ,INDIA",05/04/2016,04/04/2021
672,673,XNAT TABLET 500MG,B4-6264,CEFUROXIME AXETIL USP 500MG,TABLET/1X10,"AL-TINEZ PHARMACEUTICAL LTD 18, JONES STREET, EBUTE METTA (WEST) LAGOS","BAROQUE PHARMACEUTICALS PVT LTD SOKHADA- 388 620 INDIA ,INDIA",05/04/2016,04/04/2021
673,674,DERMOPLAST PAIN RELIEVING ANTIBACTERIAL SPRAY,B4-6122,"BENZETHONIUM CHLORIDE USP 0.2%, BENZOCAINE USP 20%",SPRAY/1X2.75oz (78G),"FRYDA NIGERIA LTD 19, SYLVIA CRESCENT, ANTHONY VILLAGE, LAGOS","AMERICAN SPRAYTECH 205 MEISTER AVE, BRANCHBURG, NJ 08876 USA ,INDIA",05/04/2016,04/04/2021
674,675,DERMOPLAST PAIN RELIEVING SPRAY (BURN AND ITCH),B4-6121,"BENZOCAINE USP 20%, MENTHOL USP 0.5%",SPRAY/ 1X2.75oz (78G),"FRYDA NIGERIA LTD 19, SYLVIA CRESCENT, ANTHONY VILLAGE, LAGOS","AMERICAN SPRAYTECH 205 MEISTER AVE, BRANCHBURG, NJ 08876 USA ,INDIA",05/04/2016,04/04/2021
675,676,ROPEM 500MG INJECTION,B4-6265,MEROPENEM (AS TRIHYDRATE) USP EQ TO MEROPENEM (ANHYDROUS) 500MG,INJECTION/1X1CO- PACK (1 VIAL + DILUENT),"GENEITH PHARMA LTD 14A, OSHODI APAPA EXPRESSWAY OSHODI LAGOS","ZEISS PHARMACEUTICALS (P) LTD PLOT NO. 72, EPIP, PHASE-1 DIST. SOLAN (H.P) INDIA ,INDIA",05/04/2016,04/04/2021
676,677,CIPROXACT TABLET,B4-6266,CIPROFLOXACIN USP 500MG,TABLET/1X10,"TAUREAN PHARMACEUTICAL LTD 2C OCONNOR STREET, AMERICAN QUARTERS, ONITSHA ANAMBRA STATE","HALEWOOD LABORATORIES PVT LTD PLOT NO. 319, PHASE II, GIDC, VATVA, AHMEDABAD- 382 445, GUJARAT INDIA ,INDIA",05/04/2016,04/04/2021
677,678,ROPEM 1000MG INJECTION,B4-6267,MEROPENEM (AS TRIHYDRATE) USP EQ TO MEROPENEM (ANHYDROUS) 1000MG,INJECTION/ 1X1C0- PACK (1 VIAL + DILUENT),"GENEITH PHARMA LTD 14A, OSHODI APAPA EXPRESSWAY OSHODI LAGOS","ZEISS PHARMACEUTICALS (P) LTD PLOT NO. 72, EPIP, PHASE-1 DIST. SOLAN (H.P) INDIA ,INDIA",05/04/2016,04/04/2021
678,679,CILTAZ 2.25G INJECTION,B4-6268,"PIPERACILLIN SODIUM EQ TO PIPERACILLIN 2000MG, TAZOBACTAM SODIUM EQ TO TAZOBACTAM 250MG",INJECTION/ 1X1 COPACK (1VIAL+DILUENT),"GENEITH PHARMA LTD 14A, OSHODI APAPA EXPRESSWAY OSHODI LAGOS","ZEISS PHARMACEUTICALS (P) LTD PLOT NO. 72, EPIP, PHASE-1 DIST. SOLAN (H.P) INDIA ,INDIA",05/04/2016,04/04/2021
679,680,EGLOFEDIPINE TABLET,B4-6269,NIFEDIPINE (RETARD) 20MG,TABLET,"E-GLOBAL PHARM GMBH LTD 6 AMICHI STREET, COKER VILLAGE, ORILE IGANMU, LAGOS","SWISS PHARMA PVT LTD 3709, GIDC PHASE IV, AHMEDABAD- 382 445, AHMEDABAD INDIA ,INDIA",05/04/2016,04/04/2021
680,681,ODASOL-20 CAPSULES,B4-6270,OMEPRAZOLE USP 20MG,CAPSULE,"CIFAX EXIM LIMITED 20, MOJIDI STREET, IKEJA, LAGOS NIGERIA","NORRIS MEDICINES LIMITED PLOT NO 901/4-5, GIDC ESTATE, ANKLESHWAR INDIA ,INDIA",05/04/2016,04/04/2021
681,682,MARCFERON SYRUP,B4-6271,"ELEMENTAL IRON 30MG, FOLIC ACID 0.5MG/5ML",SYRUP/1X200ML,"MARC OLIVIA HEALTHCARE LTD 143/145, BROAD STREET. BY APONGBON BRIDGE, MARINA LAGOS NIGERIA","KESAR PHARMA PVT LTD PLOT 50 P/2, CHHATRAL-382 729, 79-KALOL, DIST GANDHINAGAR, GUJARAT, INDIA ,INDIA",05/04/2016,04/04/2021
682,683,DICHECK 1000 TABLET,B4-6272,METFORMIN 1000MG,TABLET/10X10,"ANNIE PHARMA LTD PLOT 6, ABIMBOLA WAY, ISOLO INDUSTRIAL ESTATE ISOLO LAGOS","SWISS PHARMA PVT LTD 3709, GIDC PHASE IV, AHMEDABAD- 382 445, AHMEDABAD INDIA ,INDIA",05/04/2016,04/04/2021
683,684,DICHECK 500 TABLET,B4-6273,METFORMIN SUSTAINED RELEASE 500MG,TABLET/10X10,"ANNIE PHARMA LTD PLOT 6, ABIMBOLA WAY, ISOLO INDUSTRIAL ESTATE ISOLO LAGOS","SWISS PHARMA PVT LTD 3709, GIDC PHASE IV, AHMEDABAD- 382 445, AHMEDABAD INDIA ,INDIA",05/04/2016,04/04/2021
684,685,JEMPRIDE 2 TABLET,B4-6274,GLIMEPIRIDE 2MG USP,TABLET/10X10,"ANNIE PHARMA LTD PLOT 6, ABIMBOLA WAY, ISOLO INDUSTRIAL ESTATE ISOLO LAGOS","SWISS PHARMA PVT LTD 3709, GIDC PHASE IV, AHMEDABAD- 382 445, AHMEDABAD INDIA ,INDIA",05/04/2016,04/04/2021
685,686,SHALIDERM CREAM,B4-6275,"CLOTRIMAZOLE BP 1.0%W/W, BECLOMETHASONE DIPROPIONATE BP 0.025%W/W, GENTAMYCIN 0.1%W/W",CREAM/1X30G,"GENEITH PHARMA LTD 14A, OSHODI APAPA EXPRESSWAY OSHODI LAGOS","ASTAMED HEALTHCARE (1) PVT LTD PLOT NO. 2&3, PHASE II GENESIS INDUSTRIAL COMPLEX, KALGAON THANE- 401 404, MAHARASHTRA INDIA ,INDIA",05/04/2016,04/04/2021
686,687,XNAT TABLET 250MG,B4-6276,CEFUROXIME AXETIL USP 250MG,TABLET/10X10,"AL-TINEZ PHARMACEUTICAL LTD 18, JONES STREET, EBUTE METTA (WEST) LAGOS","BAROQUE PHARMACEUTICALS PVT LTD SOKHADA- 388 620 INDIA ,INDIA",05/04/2016,04/04/2021
687,688,DYSURE TABLET,B4-6277,"DIHYDROARTEMISIN IN 40MG, PIPERAQUINE PHOSPHATE 320MG",TABLET/1X9,"SURE DRUGS HEALTHCARE. NO 8 RASHEED ALATISE STREET, MAGODO ISHERI LAGOS","RELISH PHARMACEUTICALS LIMITED 795, RAKANPUR, SOLA- SANTEJ ROAD, TA. KALOL, DIST. GANDHINAGAR, GUJARAT INDIA ,INDIA",05/04/2016,04/04/2021
688,689,JEMPRIDE 1 TABLET,B4-6278,GLIMEPIRIDE 1MG USP,TABLET/10X10,"ANNIE PHARMA LTD PLOT 6, ABIMBOLA WAY, ISOLO INDUSTRIAL ESTATE ISOLO LAGOS","SWISS PHARMA PVT LTD. 3709, GIDC PHASE IV, AHMEDABAD- 382 445, AHMEDABAD INDIA ,INDIA",05/04/2016,04/04/2021
689,690,CILTAZ 4.5G INJECTION,B4-6279,"PIPERACILLIN SODIUM EQ TO PIPERACILLIN 4G, TAZOBACTAM SODIUM EQ TO TAZOBACTAM O.5G",INJECTION/1X1VIAL+ DILUENT (10ML),"GENEITH PHARMA LTD 14A, OSHODI APAPA EXPRESSWAY OSHODI LAGOS","ZEISS PHARMACEUTICALS (P) LTD PLOT NO. 72, EPIP, PHASE-1 DIST. SOLAN (H.P) INDIA ,INDIA",05/04/2016,04/04/2021
690,691,ARTEMETHER 80MG AND LUMEFANTRINE 480MG TABLET,B4-6280,"ARTEMETHER 80MG, LUMEFANTRINE 480MG",TABLET/1X6,"CHEV INTERNATIONAL LTD 13, ADEYEMI STREET, OSHODI, LAGOS.","RHYDBURG PHARMACEUTICALS LTD C-2 & 3, SIEL, SELAQUI DEHRADUN UTTARAKHAND INDIA ,INDIA",05/04/2016,04/04/2021
691,692,CIPROFLOXACIN 500 TABLET,B4-6281,CIPROFLOXACIN HYDROCHLORIDE BP EQ TO CIPROFLOXACIN 500MG,TABLET/1X10,"CHEV INTERNATIONAL LTD 13, ADEYEMI STREET, OSHODI, LAGOS.","RHYDBURG PHARMACEUTICALS LTD C-2 & 3, SIEL, SELAQUI DEHRADUN UTTARAKHAND INDIA ,INDIA",05/04/2016,04/04/2021
692,693,CIPROFLOXACIN 500 AND TINIDAZOLE 600MG,B4-6282,"CIPROFLOXACIN HYDROCHLORIDE BP EQ TO CIPROFLOXACIN 500MG, TINIDAZOLE BP 600MG",TABLET/1X10,"CHEV INTERNATIONAL LTD 13, ADEYEMI STREET, OSHODI, LAGOS.","RHYDBURG PHARMACEUTICALS LTD C-2 & 3, SIEL, SELAQUI DEHRADUN UTTARAKHAND INDIA ,INDIA",05/04/2016,04/04/2021
693,694,ZOOCLAV 228.5MG/5ML POWDER FOR ORAL SUSPENSION,B4-6283,"AMOXICILLIN TRIHYDRATE 200MG, CLAVULANATE POTASSIUM 28.5MG",POWDER/1X228.5MG /5ML,ZOOMOTA HEALTHCARE LTD 2B ILOJO CRESCENT OBANIKORO LAGOS NIGERIA,"SHERRINGTON PHARMACEUTICALS PVT LTD NO 296/716, I.D.A., BOLLARAM, MEDAK DISTRICT-502 325 ANDRA PRADESH INDIA ,INDIA",05/04/2016,04/04/2021
694,695,SUNYMET LOPERAMIDE CAPSULE,B4-6284,LOPERAMIDE HCL BP 2MG,CAPSULE/1X10,"SUNYMET PHARMACEUTICALS LTD 65, FREETOWN, SABON GARI, KANO STATE","NAVKETAN PHARMA PVT LIMITED F-106 MIDC AREA, WALUJ, DIST. AURANGABAD- 431 136 (M.S.) INDIA ,INDIA",05/04/2016,04/04/2021
695,696,SUNYMET DICLOFENAC 100 TABLET,B4-6285,DICLOFENAC SODIUM B.P 100MG (SUSTAINED RELEASE),TABLET/ 1X10,"SUNYMET PHARMACEUTICALS LTD 65, FREETOWN, SABON GARI, KANO STATE","KESAR PHARMA (P) LTD PLOT NO. 50, P/2 AT VILLAGE BILESHWARPURA, CHHATRAL, TALUKA- KALOL, DIST- GANDHINAGAR (GUJARAT) INDIA ,INDIA",05/04/2016,04/04/2021
696,697,FLURBIPROFEN E EYE DROPS,B4-6286,FLURBIPROFEN SODIUM 0.03%,DROPS/1X5ML,"MICRONOVA PHARM IND LTD. PLOT 3 BILLINGSWAY OREGUN IND. ESTATE, ALAUSA IKEJA LAGOS","MICROLABS 92, SIPCOT INDUSTRIAL COMPLEX HOSUR- 635 126 (T.N) INDIA ,INDIA",05/04/2016,04/04/2021
697,698,MICROMOX EYE DROPS,B4-6287,MOXIFLOXACIN 0.5%W/V,SOLUTION/1X5ML,"MICRONOVA PHARM IND. LTD PLOT 3 BILLINGSWAY OREGUN IND. ESTATE, ALAUSA IKEJA LAGOS","MICROLABS LTD NO. 113 TO 116, 4TH PHASE, K. I. A.D.B, BANGALORE- 560 099, INDIA ,INDIA",05/04/2016,04/04/2021
698,699,LEVOSEAL TABLET,B4-6288,LEVOFLOXACIN HEMIHYDRATE USP EQ TO LEVOFLOXACIN 500MG,TABLET/1X10,"MAXICURE PHARMACEUTICALS LTD NO 24, OKOTA ROAD, ISOLO LAGOS","MAAN PHARMACEUTICALS LTD PLOT I, G.I.D.C PHASE II, MODHERA ROAD, MEHSANA 384 002 GUJARAT INDIA ,INDIA",05/04/2016,04/04/2021
699,700,ERYTHROFAITH- 500 TABLET,B4-6289,ERYTHROMYCIN STEARATE BP 500MG,TABLET/1X10,"DANNYFAITH PHARMACY LTD 23, OSENI STREET, LAWANSON LAGOS","McW HEALTHCARE PVT LTD 286, 287A, 287B, SECTOR-E, INDUSTRIAL AREA, SANWER ROAD. INDORE (M.P) INDIA ,INDIA",05/04/2016,04/04/2021
700,701,FRESHVIT CAPSULE,B4-6290,MULTIVITAMIN AND MINERALS WITH GINSENG,CAPSULE/2X15,"MORE STAR PHARMACEUTICAL LTD 73, IJESHA ROAD SURULERE LAGOS","RENOWN PHARMACEUTICALS PVT LTD SURVEY NO 143/A&B, VILLAGE-RANU TALUKA- PADRA, DIST-VADODARA- 391 445 (GUJARAT) INDIA ,INDIA",05/04/2016,04/04/2021
701,702,KUNAMA EXTRA GEL,B4-6291,"DICLOFENAC DIETHYL- AMMONIUM 1.16%W/W, LINSEED OIL 1%W/W, LINSEED OIL 3%W/W, METHYL SALICYLATE BP 10% W/W, MENTHOL 5%W/W",GEL/1X30G,"ZEENAT NIGERIA LTD PLOT 384, YANSHANA ROAD, NAIBAWA QUARTERS, KANO STATE","CIRON DRUGS AND PHARMACEUTICAL PVT LTD N- 118/119, MIDC. TARAPUR, BOISAR, DIST. THANE- 401 506, INDIA ,INDIA",05/04/2016,04/04/2021
702,703,OESTRAFERT TABLET,B4-6292,ESTRADIOL VALERATE USP 2MG,TABLET/ 1X28,"MARK PHARMA LTD 21, MORONU MADUGWU CRESCENT OFF IBEZIM OBIAJULU STREET OFF ADEIABU ROAD, SURULERE LAGOS","WEST-COAST PHARMA WORKS LTD FP NO. 17 & 16/5 MELDI ESTATE B/S MELDI MATA TEMPLE NR GOTA RAILWAY CROSSING AT & POST GOTA AHMEDABAD 382 481 GUJARAT INDIA ,INDIA",05/04/2016,04/04/2021
703,704,ZUKCURE CAPSULE,B4-6293,LOPERAMIDE HYDROCHLORIDE USP 2MG,CAPSULE/1X10,"ZUNAMEDIKS (NIG) LTD NO 8, IFITEDUNU STREET, OMAGBA PHASE 1, ONITHA NIGERIA","GLOW PHARMA PVT LTD PLOT NO. 26,27,28/2, SHANGRILLA INDL. COMPLEX, VASAI (EAST), DIST PALGHAR-401 208 INDIA ,INDIA",05/04/2016,04/04/2021
704,705,PHARMATEN- QS TABLET,B4-6294,"ARTEMETHER 80MG, LUMEFANTRINE 480MG",TABLET/1X6,"PHARMABOX VENTURES LTD NO 4, OHALIA STREET, AGO OKOTA ISOLO LAGOS NIGERIA","McCOY PHARMA PVT LTD S-12, M.I.D.C., TARAPUR, BOISAR, DIST. THANE-401 501 MAHARASHTRA INDIA ,INDIA",05/04/2016,04/04/2021
705,706,BOND CO- AMOXYCLAV TABLET,B4-6295,"AMOXYCILLIN TRIHYDRATE BP 500MG, POTASSIUM CLAVULANATE BP 125MG",TABLET/ 1X10,"BOND CHEMICAL IND. LTD 22, ALAFIA STREET, OFF ISOLO ROAD MUSHIN LAGOS","FINE CURE PHARMACEUTICALS LTD SHIMLA PISTAUR, MALSA ROAD, KICHHA, UDHAMSINGH NAGAR, UTTARAKHAND-263 148 INDIA ,INDIA",05/04/2016,04/04/2021
706,707,ZEDEX COLD CAPSULE,B4-6296,"ACETAMINOPHEN 325MG, DEXTROMETHORPH AN HYDROBROMIDE 10MG, PHENYLEPHRINE HYDROCHLORIDE 5MG",CAPSULE/ 1X10,"WOCKHARDT NIG. LTD 38, FATAI IRAWO STREET, AJAO ESTATE LAGOS","SOFTGEL HEALTHCARE PVT LIMITED SURVEY NO. 20/1, VANDALUR- KELAMBAKKAM ROAD, PUDUPAKKAM VILLAGE, KANCHEEPURAM DISTRICT, TAMILNADU INDIA ,INDIA",05/04/2016,04/04/2021
707,708,ZEDEX D CAPSULE,B4-6297,"ACETAMINOPHEN 325MG, DEXTROMETHORPH AN HYDROBROMIDE 10MG, DOXYLAMINE SUCCINATE 6.25MG",CAPSULE/1X10,"WOCKHARDT NIG. LTD 38, FATAI IRAWO STREET, AJAO ESTATE LAGOS","SOFTGEL HEALTHCARE PVT LIMITED SURVEY NO. 20/1, VANDALUR- KELAMBAKKAM ROAD, PUDUPAKKAM VILLAGE, KANCHEEPURAM DISTRICT, TAMILNADU INDIA ,INDIA",05/04/2016,04/04/2021
708,709,TELMINORM 20 TABLETS,B4-6298,TELMISARTAN 20MG USP,TABLETS/3X10,"IPCA PHARMA NIG. LTD 17, OSOLO WAY, AJAO ESTATE, ISOLO LAGOS","IPCA LABORATORIES LTD SEJAVTA, RATLAM 457002 MUMBAI INDIA ,INDIA",28/04/2016,27/04/2021
709,710,TELMINORM 40 TABLETS,B4-6299,TELMISARTAN 40MG USP,TABLETS/3X10,"IPCA PHARMA NIG. LTD 17, OSOLO WAY, AJAO ESTATE, ISOLO LAGOS","IPCA LABORATORIES LTD SEJAVTA, RATLAM 457002 MUMBAI INDIA ,INDIA",28/04/2016,27/04/2021
710,711,TELMINORM 80 TABLETS,B4-6300,TELMISARTAN 80MG USP,TABLETS/3X10,"IPCA PHARMA NIG. LTD 17, OSOLO WAY, AJAO ESTATE, ISOLO LAGOS","IPCA LABORATORIES LTD SEJAVTA, RATLAM 457002 MUMBAI INDIA ,INDIA",28/04/2016,27/04/2021
711,712,OMECET PLUS COMBI KIT,B4-6301,"CLARITHROMYCIN USP 250MG, OMEPRAZOLE BP 20MG, TINIDAZOLE BP 500MG",CAPSULES/TABLETS/7 X2 COMBI KITS,"MAYDON PHARMACEUTICALS LTD 15, WILMER STREET, OFF TOWN PLANNING WAY, ILUPEJU, LAGOS","MAXHEAL LABORATORIES PVT LTD 2-7/80-85, SURSEZ SACHIN, DIST. SURAT, GUJARAT-394230 INDIA ,INDIA",28/04/2016,27/04/2021
712,713,ROYALE BENZHEXOL TABLETS,B4-6302,TRIHEXYPHENIDYL HYDROCHLORIDE BP 5MG,TABLETS/1X 1000,ROYALE RESOURCES LTD 12 & 20 FEMI KILA STREET OFF AGO PALACE WAY OKOTA ISOLO LAGOS,"MCW HEALTHCARE (P) LTD 286, 287-A, 287-B, SECTOR E, INDUSTRIAL AREA, SANWER ROAD, INDORE (M.P) INDIA ,INDIA",28/04/2016,27/04/2021
713,714,ST DENNIS METRONIDAZO LE INFUSION,B4-6303,METRONIDAZOLE USP 0.5%W/V,INFUSION/1X100ML,"DENROBE NIG. LTD 50, OKITO STREET, AWODIORA APAPA LAGOS","PROTECH BIOSYSTEMS PVT LTD KH. NO.936, 937 & 939 KISHANPUR, JAMAIPUR, ROORKEE DIST. HARIDWAR, UTTARAKHAND INDIA ,INDIA",28/04/2016,27/04/2021
714,715,ST DENNIS CIPROFLOXACIN INFUSION,B4-6304,CIPROFLOXACIN LACTATE USP EQV TO CIPROFLOXACIN 0.2%W/V,INFUSION/1X100ML,"DENROBE NIG. LTD 50, OKITO STREET, AWODIORA APAPA LAGOS","PROTECH BIOSYSTEMS PVT LTD KH. NO.936, 937 & 939 KISHANPUR, JAMAIPUR, ROORKEE DIST. HARIDWAR, UTTARAKHAND INDIA ,INDIA",28/04/2016,27/04/2021
715,716,OMEPRAZOLE CAPSULES,B4-6305,OMEPRAZOLE BP 20MG,CAPSULES/1X10,"ELJAY PHARM LTD 42, YUSUF TAWAI STREET, U/PAMA SABO KADUNA STATE.","HALEWOOD LABORATORIES PVT LTD PLOT NO. 319, PHASE-II GIDC VATVA, AHMEDABAD, GUJARAT, INDIA ,INDIA",28/04/2016,27/04/2021
716,717,ELBUFEN TABLETS,B4-6306,IBUPROFEN BP 400MG,TABLETS/1 X10,"ELJAY PHARM LTD 42, YUSUF TAWAI STREET, U/PAMA SABO KADUNA STATE.","HALEWOOD LABORATORIES PVT LTD PLOT NO. 319, PHASE-II GIDC VATVA, AHMEDABAD, GUJARAT, INDIA ,INDIA",28/04/2016,27/04/2021
717,718,CIPROFLOXACIN TABLET,B4-6307,CIPROFLOXACIN HYDROCHLORIDE BP EQV TO CIPROFLOXACIN 500MG,TABLETS/1X10,"ELJAY PHARM LTD 42, YUSUF TAWAI STREET, U/PAMA SABO KADUNA STATE.","HALEWOOD LABORATORIES PVT LTD PLOT NO. 319, PHASE-II GIDC VATVA, AHMEDABAD, GUJARAT, INDIA ,INDIA",28/04/2016,27/04/2021
718,719,ELITHER INJECTION,B4-6308,ARTEMETHER 80MG/ML,INJECTION/6X1ML AMPOULES,"ELJAY PHARM LTD 42, YUSUF TAWAI STREET, U/PAMA SABO KADUNA STATE.","DIVINE LABORATORIES PVT LTD NO. 471 DABHASA. TAL. PADRA, DIST- BARODA, GUJARAT- 391440, GUJARAT INDIA ,INDIA",28/04/2016,27/04/2021
719,720,ZYMETHROCIN TABLETS,B4-6309,ERYTHROMYCIN STEARATE BP EQV TO ERYTHROMYCIN 500MG,TABLETS/10X10,"ZMC INTERNATIONAL LTD NO.7, NIGER STREET KANO STATE","JAY FORMULATIONS LTD PLOT NO. 1301 & U-1, GIDC KERALA (BAVLA) DIST: AHMEDABAD- 382220 GUJARAT INDIA ,INDIA",28/04/2016,27/04/2021
720,721,CIPROFLOXACIN TABLETS,B4-6310,CIPROFLOXACIN HYDROCHLORIDE BP EQV TO CIPROFLOXACIN 500MG,TABLETS/1X10,"DON-J PHARMACY LTD 34, MURTALA MUHAMMED WAY, KANO, KANO STATE","ZOTA HEALTHCARE LTD PLOT NO. 169, SURAT SPECIAL ECONOMIC ZONE, SACHIN, SURAT- 394230 GUJARAT INDIA ,INDIA",28/04/2016,27/04/2021
721,722,DERMORAL TABLETS,B4-6311,KETOCONAZOLE USP 200MG,TABLETS/10X10,BIOMEDICINE S.P.N.L NO.16 ANIONWU STREET ODOAKPU ONITSHA ANAMBRA STATE,"BHARAT PARENTERALS LTD VILL. HARIPURA, TA.SAVLI DIST. VADODARA-391520 GUJARAT INDIA ,INDIA",28/04/2016,27/04/2021
722,723,CAFLUDIN 200 CAPSULE,B4-6312,FLUCONAZOLE USP 200MG,CAPSULES/1X10,BIOMEDICINE S.P.N.L NO.16 ANIONWU STREET ODOAKPU ONITSHA ANAMBRA STATE,"BHARAT PARENTERALS LTD VILL. HARIPURA, TA.SAVLI DIST. VADODARA-391520 GUJARAT INDIA ,INDIA",28/04/2016,27/04/2021
723,724,KASIFA ORAL SUSPENSION,B4-6313,AZITHROMYCIN USP 200MG/5ML,POWDER /1X30ML,"MEDICROWN NIG LTD 7, ILAROROLAD OFF AIRPORT ROAD SABON GARI KANO, KANO STATE","ZENITH HEALTHCARE LTD 388/24, CHANGODAR IND. EST. CHANGODAR- 382210, DIST. AHMEDABAD, GUJARAT INDIA ,INDIA",28/04/2016,27/04/2021
724,725,KASIFA TABLETS,B4-6314,AZITHROMYCIN USP 500MG,TABLETS/1X10,"MEDICROWN NIG LTD 7, ILAROROLAD OFF AIRPORT ROAD SABON GARI KANO, KANO STATE","ZENITH HEALTHCARE LTD 388/24, CHANGODAR IND. EST. CHANGODAR- 382210, DIST. AHMEDABAD, GUJARAT INDIA ,INDIA",28/04/2016,27/04/2021
725,726,MYCORON PLUS CREAM,B4-6315,"CLOTRIMAZOLE USP 1%W/W, BETAMETHASONE DIPROPIONATE USP EQV TO BETAMETHASONE 0.05%W/W, NEOMYCIN SULFATE USP 0.5%W/W",CREAM/1X30G,"JUSTEEN PHARMA LTD 57B COKER ROAD, ILUPEJU LAGOS","YASH MEDICARE PVT LTD NR SABAR DAIRY TALOD ROAD PO HAIIPUR, HIMATNAGAR GUJARAT, INDIA ,INDIA",28/04/2016,27/04/2021
726,727,NITRESS TABLETS,B4-6316,ZOPICLONE 7.5MG,TABLETS/10X10,"TETA PHARMACEUTICALS (NIG) LTD 4, OKEHO STREET, IREKARI ESTATE ISOLO, LAGOS","LESANTO LABORATORIES PLOT NO. 9, 10, 11 & 20, SURVEY NO. 53, MANOR ROAD PALGHAR DIST. THANE 401104 INDIA ,INDIA",28/04/2016,27/04/2021
727,728,MARCOLIVIA TRAMADOL CAPSULES,B4-6317,TRAMADOL HYDROCHLORIDE BP 100MG,CAPSULES/10X10,"MARCOLIVIA HEALTHCARE LTD MARCOLIVIA HOUSE 143/145, BROAD STREET BY APOGBON BRIDGE G.P.O 4404, MARINA LAGOS","TUTON PHARMACEUTICALS 85, GIDC NARODA, AHMEDABAD- 382330 INDIA ,INDIA",28/04/2016,27/04/2021
728,729,UNOZOLE TABLETS,B4-6318,RABEPRAZOLE SODIUM 20MG,TABLETS/3X10,"BARATA PHARMA & CO LTD 416, IKWERE ROAD, RUMUOKUTA, PORTHARCOURT, RIVERS STATE","SWISS GARNIER LIFE SCIENCES NO. 21- 23, INDUSTRIAL AREA, MEHATPUR, DIST: UNA, HIMACHAL PRADESH-174315 INDIA ,INDIA",28/04/2016,27/04/2021
729,730,SUNYCIP TABLETS,B4-6319,CIPROFLOXACIN HYDROCHLORIDE BP EQV TO CIPROFLOXACIN 500MG,TABLETS/1X10,"SUNYMET PHARM LTD NO. 14E, IBRAHIM TAIWO ROAD, KANO","MANCARE PHARMA PVT LTD PLOT NO. 59, 60, 85, 86, V.M.I.E DOWALI VILLAGE, VASAI (W) DIST. THANE MAHARASHTRA INDIA ,INDIA",28/04/2016,27/04/2021
730,731,DPAT TABLETS,B4-6320,"DIHYDROARTEMISIN IN 40MG, PIPERAQUINE PHOSPHATE 320MG",TABLETS/1X9,"OMAK PHARMA NIG LTD SUITE 1 & 2, VICTORIA'S PLACE, BODIJA IBADAN OYO STATE","KWALITY PHARMACEUTICALS (P) LTD NAG KALAN, MAJITHA ROAD, AMRITSAR INDIA ,INDIA",28/04/2016,27/04/2021
731,732,MAKOSUNATE INJECTION,B4-6321,ARTESUNATE 60MG,INJECTIONX1 VIAL COMBI PACK,"OMAK PHARMA NIG LTD SUITE 1 & 2, VICTORIA'S PLACE, BODIJA IBADAN OYO STATE","CIRION DRUGS & PHARMA PVT LTD N-118/119 MIDC TARAPUR, BOISAR, DIST THANE-401506 INDIA ,INDIA",28/04/2016,27/04/2021
732,733,GLIMERYL TABLETS,B4-6322,GLIMEPIRIDE USP 2MG,TABLETS/3X10,"OMAK PHARMA NIG LTD SUITE 1 & 2, VICTORIA'S PLACE, BODIJA IBADAN OYO STATE","KWALITY PHARMACEUTICALS PVT LTD NAG KALAN, MAJITHA ROAD, AMRITSAR INDIA ,INDIA",28/04/2016,27/04/2021
733,734,PROPRANOLOL 40MG TABLETS,B4-6323,PROPRANOLOL HYDROCHLORIDE USP 40MG,TABLETS/2X14,"FIRST J POCCO PHARMACY LTD 89, DENIS OSADEBE WAY, ASABA DELTA STATE","SCOTT EDIL PHARMCIA LTD 56, EPIP, PHASE-1 JHARMAJRI, BADDI DIST SOALN (H.P) INDIA ,INDIA",28/04/2016,27/04/2021
734,735,AMLOKRIS 10MG TABLETS,B4-6324,AMLODIPINE BESILATE BP EQV TO AMLODIPINE 10MG,TABLETS/10X2X14,"KRISHAT PHARMA IND. LTD 9, KILOMETER OLD LAGOS ROAD, PODO IBADAN OYO STATE","GENRX PHARMACEUTICALS PVT LTD A-52, MALEGAON MIDC AREA, SINNAR DIST. NASHIK-422113 INDIA ,INDIA",28/04/2016,27/04/2021
735,736,AMLOKRIS 5MG TABLETS,B4-6325,AMLODIPINE BESILATE BP EQV TO AMLODIPINE 5MG,TABLETS/10X2X14,"KRISHAT PHARMA IND. LTD 9, KILOMETER OLD LAGOS ROAD, PODO IBADAN OYO STATE","GENRX PHARMACEUTICALS PVT LTD A-52, MALEGAON MIDC AREA, SINNAR DIST. NASHIK-422113 INDIA ,INDIA",28/04/2016,27/04/2021
736,737,LISIKRIS 10MG TABLETS,B4-6326,LISINOPRIL DIHYDRATE USP EQV TO LISINOPRIL 10MG,TABLETS/10X2X14,"KRISHAT PHARMA IND. LTD 9, KILOMETER OLD LAGOS ROAD, PODO IBADAN OYO STATE","GENRX PHARMACEUTICALS PVT LTD A-52, MALEGAON MIDC AREA, SINNAR DIST. NASHIK-422113 INDIA ,INDIA",28/04/2016,27/04/2021
737,738,LISIKRIS 5MG TABLETS,B4-6327,LISINOPRIL DIHYDRATE USP EQV TO LISINOPRIL 5MG,TABLETS/10X2X14,"KRISHAT PHARMA IND. LTD 9, KILOMETER OLD LAGOS ROAD, PODO IBADAN OYO STATE","GENRX PHARMACEUTICALS PVT LTD ,INDIA",28/04/2016,27/04/2021
738,739,"KRISHAT NYSTATIN ORAL SUSPENSION BP 100,000IU/ML",B4-6328,"NYSTATIN BP 100,000IU",SUSPENSION/1X30ML,"KRISHAT PHARMA IND. LTD 9, KILOMETER OLD LAGOS ROAD, PODO IBADAN OYO STATE","S KANT HEALTHCARE LTD 1802-1805 GIDC PHASE-III VAPI- 396195 GUJARAT INDIA ,INDIA",28/04/2016,27/04/2021
739,740,GLOBAL YOUNG DEXAMETHASO NE TABLETS BP 0.5MG,B4-6329,DEXAMETHASONE BP 0.5MG,TABLETS/10X10,"GLOBAL YOUNG PHARM LTD AGARA BAB PUPA, ROAD 5 (HOUSE NO. 3) OFF ODO-ONA ELEWE, NEW GARAGE, IBADAN OYO STATE","MANCARE PHARMA PVT LTD PLOT NO. 59, 60, 85, 86, V.M.I.E DOWALI VILLAGE, VASAI (W) DIST. THANE MAHARASHTRA INDIA ,INDIA",28/04/2016,27/04/2021
740,741,CISEPRO-500 TABLETS,B4-6330,CIPROFLOXACIN HYDROCHLORIDE USP EQV TO CIPROFLOXACIN 500MG,TABLETS/1X10,"PART-ONE PHARMACY LTD 160, ARODIEZUOGU ROAD, AKOKWA, IMO STATE","FREDUN PHARMA LTD 14, 15, 16 ZORABIAN INDUSTRIAL COMPLEX VEOOR, PALGHAR (E) - 401404, INDIA ,INDIA",28/04/2016,27/04/2021
741,742,ADVENTIN TABLETS,B4-6331,"AMOXICILLIN TRIHYDRATE BP EQV TO AMOXICILLIN 500MG, POTASSIUM CLAVULANATE BP EQV TO CLAVULANIC ACID 125MG",TABLETS/2X7,"SJS LIFE SCIENCES LTD NO. 11 OLU AKERELE STREET, IKEJA LAGOS","FINECURE PHARMACEUTICALS LTD SHIMLA PISTAUR, MALSA ROAD, KICHHA, UDHAM SINGH NAGAR, UTTARAKHAND- 263148, INDIA ,INDIA",28/04/2016,27/04/2021
742,743,KENACO TABLETS,B4-6332,ACECLOFENAC BP 100MG,TABLETS/10X10,"KEN-ANGEL PHARMACY 371, IKWERE ROAD MILI 4 RUMUEME, PORT HARCOURT RIVERS STATE","MERCURY LABORATORIES LTD UNIT NO. 2, HALOL- BARODA ROAD, VILLAGE: JAROD TAL: WAGHODIA DIST VADODARA- 391510, GUJARAT INDIA ,INDIA",28/04/2016,27/04/2021
743,744,GENTADROP EYE DROPS,B4-6333,GENTAMICIN SULPHATE BP EQV TO GENTAMICIN 0.3%W/V,DROP/1X5ML,"ONIFAM LABORATORIES SUITE C5, AMORI SHOPPING PLAZA 113 IDIMU ROAD, ORELOPE EGBEDA LAGOS","LINCOLN PARENTERALS LTD 11, TRIMUL ESTATE, KHATRAJ TAL-KALOL DIST. GANDHINAGAR GUJARAT INDIA ,INDIA",28/04/2016,27/04/2021
744,745,TELDURET 40/12.5MG TABLET,B4-6334,"TELMISARTAN USP 40MG, HYDROCHLOROTHIA ZIDE USP 12.5MG",TABLETS/3X10,"BIOGENERICS NIGERIA LTD 13, HUGHES AVENUE, ALAGOMEJI YABA LAGOS","PSYCHOTROPICS INDIA LTD PLOT NO. 46 & 49, SECTOR-6A, IIE SIDCUL, RANIPUR, HARIDWAR 249403, UTTARAKHAND INDIA ,INDIA",28/04/2016,27/04/2021
745,746,TELDURET 80/12.5MG TABLET,B4-6335,"TELMISARTAN USP 80MG, HYDROCHLOROTHIA ZIDE USP 12.5MG",TABLETS/3X10,"BIOGENERICS NIGERIA LTD 13, HUGHES AVENUE, ALAGOMEJI YABA LAGOS","PSYCHOTROPICS INDIA LTD PLOT NO. 46 & 49, SECTOR-6A, IIE SIDCUL, RANIPUR, HARIDWAR 249403, UTTARAKHAND INDIA ,INDIA",28/04/2016,27/04/2021
746,747,TELDURET 80/25MG TABLET,B4-6336,"TELMISARTAN USP 80MG, HYDROCHLOROTHIA ZIDE USP 25MG",TABLETS/3X10,"BIOGENERICS NIGERIA LTD 13, HUGHES AVENUE, ALAGOMEJI YABA LAGOS","PSYCHOTROPICS INDIA LTD PLOT NO. 46 & 49, SECTOR-6A, IIE SIDCUL, RANIPUR, HARIDWAR 249403, UTTARAKHAND INDIA ,INDIA",28/04/2016,27/04/2021
747,748,TELAM 80/5MG TABLETS,B4-6337,"TELMISARTAN 80MG, AMLODIPINE 5MG",TABLETS/3X10,"BIOGENERICS NIGERIA LTD 13, HUGHES AVENUE, ALAGOMEJI YABA LAGOS","PSYCHOTROPICS INDIA LTD PLOT NO. 46 & 49, SECTOR-6A, IIE SIDCUL, RANIPUR, HARIDWAR 249403, UTTARAKHAND INDIA ,INDIA",28/04/2016,27/04/2021
