215,216,JUROXICAM CAPSULE,04-7126,PIROXICAM U.S.P 20MG,CAPSULE 10 X 10,"JUHEL NIGERIA LIMITED 35, NKWUBOR ROAD, EMENE ENUGU STATE","JUHEL NIGERIA LIMITED 35, NKWUBOR ROAD, EMENE ENUGU STATE ,NIGERIA",31/03/2017,30/03/2022
216,217,VITAMIN -C SYRUP,04-0879,ASCORBIC ACID 40MG/5ML,"SYRUP, 1 X 100ML","KINGSIZE PHARMACEUTICALS NIG. LTD. OFF KM 15, OLD ENUGU ROAD, OGIDI, ANAMBRA STATE","KINGSIZE PHARMACEUTICALS NIG. LTD. OFF KM 15, OLD ENUGU ROAD, OGIDI, ANAMBRA STATE ,NIGERIA",31/03/2017,30/03/2022
217,218,MOPSON PROMETHAZINE SYRUP,04-4554,PROMETHAZINE HYDROCHLORIDE B.P.5MG,"SYRUP, 1 X 60ML","MOPSON PHARMA LTD 47, ISOLO WAY, AJAO ESTATE, OSHODI, LAGOS STATE.","MOPSON PHARMA LTD 47, ISOLO WAY, AJAO ESTATE, OSHODI, LAGOS STATE. ,NIGERIA",31/03/2017,30/03/2022
218,219,ZODEX DISPERSIBLE POWDER,04-6115,MEBENDAZOLE 500MG/5GM,DISPERSIBLE POWDER/ 100G,"ANIMAL CARE SERVICES KONSULT IPERU-OGERE ROAD, OFF LAGOS- IBADAN EXPRESSWAY, OGERE-REMO, OGUN STATE NIGERIA","CONCEPT PHARMACEUTICALS LTD A-28/3, MIDC CHIKALTHANA, AURAGABAD, 431- 006, INDIA ,INDIA",31/10/2017,30/10/2022
219,220,ALBIDOL-250 BOLUS,04-5227,ALBENDAZOLE 250MG,BOLI/5 X 10,"ANIMAL CARE SERVICES KONSULT IPERU-OGERE ROAD, OFF LAGOS- IBADAN EXPRESSWAY, OGERE-REMO, OGUN STATE NIGERIA","CONCEPT PHARMACEUTICALS LTD A-28/3, MIDC CHIKALTHANA, AURAGABAD, 431- 006, INDIA ,INDIA",31/10/2017,30/10/2022
220,221,WORM CARE FORTE,04-8953,LEVAMISOLE HYDROCHLORIDE/1 200MG,BOLUS/20 BOLI,"SAM PHARMACEUTICALS LTD 10, OYADIRAN ESTATE, SABO, YABA, LAGOS STATE","SAM PHARMACEUTICALS LTD 2, WESTERN RESERVOIR ROAD, ILORIN, KWARA STATE ,NIGERIA",20/12/2017,19/12/2022
221,222,NTCOX AMPROLIUM 200,04-0995,AMPROLIUM HCL /20G,WSP/100G,"SAM PHARMACEUTICALS LTD 10, OYADIRAN ESTATE, SABO, YABA, LAGOS STATE","SAM PHARMACEUTICALS LTD 2, WESTERN RESERVOIR ROAD, ILORIN, KWARA STATE ,NIGERIA",20/12/2017,19/12/2022
222,223,SAMBEZOLE'G',04-8954,ALBENDAZOLE/2500 MG,BOLUS/ 1 BOLUS,"SAM PHARMACEUTICALS LTD 10, OYADIRAN ESTATE, SABO, YABA, LAGOS STATE","SAM PHARMACEUTICALS LTD 2, WESTERN RESERVOIR ROAD, ILORIN, KWARA STATE ,NIGERIA",20/12/2017,19/12/2022
223,224,ROSART TABLETS,04-8238,LOSARTAN POTASSIUM 50MG,TABLETS,"RANBAXY NIG. LTD 1ST FLOOR, ABIMBOLA HOUSE, 24, ABIMBOLA STREET, ILASAMAJA, ISOLO, LAGOS STATE","SUN PHARMACEUTICALS IND. LTD PLOT NO. B-2, MADKAI IN DUSTRIAL ESTATE, PONDA, GOA- 403404, INDIA ,INDIA",09/02/2018,08/02/2023
224,225,ROSART TABLETS,04-8237,LOSARTAN POTASSIUM 25MG,TABLETS,"RANBAXY NIG. LTD 1ST FLOOR, ABIMBOLA HOUSE, 24, ABIMBOLA STREET, ILASAMAJA, ISOLO, LAGOS STATE","SUN PHARMACEUTICALS IND. LTD PLOT NO. B-2, MADKAI IN DUSTRIAL ESTATE, PONDA, GOA- 403404, INDIA ,INDIA",09/02/2018,08/02/2023
225,226,AVOBAC TABLETS,04-6467,ABACAVIR SULFATE 300MG,TABLETS,"RANBAXY NIG. LTD 1ST FLOOR, ABIMBOLA HOUSE, 24, ABIMBOLA STREET, ILASAMAJA, ISOLO, LAGOS STATE","RANBAXY LABORATORIES LIMITED PAONTA SAHIB, DIST. SIRMOUR H.P - 173 025, INDIA ,INDIA",09/02/2018,08/02/2023
226,227,JOINTACE,04-6434,"GLUCOSAMINE SULPHATE POTASSIUM USP 750MG, METHYL SULFONYL METHANE 200MG,VITAMINS AND MINERALS",TABLETS,ADLER PRODUCTS LTD. 28/32 ODUYEMI STREET IKEJA LAGOS STATE,"M/S MEYER ORGANICS PVT LTD NO. 10-D, 2ND PHASE, PEENYS IND AREA, BANGALORE 560 058, INDIA ,INDIA",27/02/2018,26/02/2023
227,228,RICHDOL INJECTION,04-8487,PARACETAMOL INJECTION,INJECTION,"GOLD MOORE INTERNATIONAL LIMITED 58 OLORULOGBON STREET, ANTHONY VILLAGE LAGOS","CIRON DRUGS AND PHARMACEUTICALS PVT LIMITED N- 118,N-119, MDIC, TARAPUR, BOISAR.DIST, THANE: 401 506, INDIA ,INDIA",27/02/2018,26/02/2023
228,229,NOVOLAX TABLETS,04-2004,BISACODYL 5MG,TABLET,"MAYDON PHARMACETICALS LIMITED 15 WILMER STREET, OFFTOWN PLANNING WAY, ILUPEJU, LAGOS","MAXHEAL LABORATOTRIES LIMITED 2-7/80-85 SURSEZ SACHIN, GUJARAT, 394730, INDIA ,INDIA",27/02/2018,26/02/2023
229,230,FALBITONE PLUS CAPSULES,04-0778,IRONS WITH VITAMINS AND MINERALS,CAPSULE,"FALIMA ORGANICS LTD 5,JINADU CLOSE OFF LAGOS- ABEOKUTA EXPRESS WAY AMJE, LAGOS","MARS REMEDIES PVT LTD 635,GIDC ESTATE,WAGHODIA ,VADORADA, GUJARAT, INDIA ,INDIA",27/02/2018,26/02/2023
230,231,GLOCOD CAPSULES,04-5726,COD LIVER OIL 300MG,CAPSULE,"GOLD MOORE INTERNATIONAL LIMITED 58, OLORUNLOGBON STREET, ANTHONY VILLAGE, LAGOS STATE","GUJARAT LIQUI PHARMACAPS(P) PLOT NO 662-666, GDIC, WAGHODIA, VADODARA- 391760, GUJARAT INDIA ,INDIA",27/02/2018,26/02/2023
231,232,MAXIRON CAPSULE,04-714,FERROUS FUMARATE WITH FOLIC ACID & VITAMIN B12,CAPSULE,"SAM PHARMACEUTICAL LIMITED SABO YABA, LAGOS NIGERIA","SWISS PHARMA PVT LTD. 3709 G.I.D.C PHASE IV, VALVA, AHMEDABAD - 382 445, GUJARAT, INDIA ,INDIA",27/02/2018,26/02/2023
232,233,RICAM CAPSULE,04-5408,PIROXICAM CAPSULE,CAPSULE,"RICHYGOLD INTERNATIONAL LIMITED 103C AMUWODOFIN INDUSTRIAL SCHEME, OFF OSHODI APAPA EXPRESSWAY, LAGOS","GLOW PHARMA PVT LTD PLOT NO 28,27,28/2 SHANGRILLA INDUSTRIAL COMPLEXCHINCHP ADA, POKHIVARE VASAI THANE, MARAHASHTRA, INDIA ,INDIA",27/02/2018,26/02/2023
233,234,STREZIA,04-9184,"RIBOFLAVIN 93MG, PYRIDOXINE HCL 122MG, NIACINAMIDE 350MG, CALCIUM D- PANTOTHENATE 326MG, VIT B12 256MCG, FOLIC ACID 10MG, SODIUM CHLORIDE 20MG, POTASSIUM CHLORIDE 20G, CALCIUM LACTATE 28.570G, MAGNESIUM SULPHATE 8.340G, DEXTROSE 20G,",POWDER/100G,"GLOBAL ORGANICS LTD 81/A, LAMIDO ROAD, KANO STATE, NIGERIA","PHAMANZA INDIA PVT LTD 70/1, GIDC ESTATE, KANSARI- 388630, KHAMBHAT, GUJARAJ INDIA. ,INDIA",09/02/2018,08/02/2023
234,235,NICHBEN PARACETAMOL TABLETS,04-0833,PARACETAMOL 500MG,TABLETS X 10 X 10,"PHOENIX SPECIALTIES NIGERIA LIMITED 25/26 KM, AWO- OMAMMA,OWERRI- ONITSHA ROAD, IMO STATE","NICHBEN PHARMACEUTICALS IND. LTD. KM. 25- 26, OWERRI/ONITSHA ROAD, AWO- OMMAMMA, IMO STATE. ,NIGERIA",04/04/2018,03/04/2023
235,236,REFUCIL SUSPENSION,04-4702,GRISEOFULVIN 125MG/5ML,SUSPENSION,"REAL PHARMACEUTICALS LTD REALS PLAZ, PLOT 1 , JUNAID DOSUNMU STR., ALAUSA, IKEJA, LAGOS STATE","ECOMED PHARM LTD. PLOT 32, LYNSON CHEMICAL AVENUE, OFF KM 38, LAGOS- ABEOKUTA EXPRESSWAY, SANGO OTA, OGUN STATE ,NIGERIA",04/04/2018,03/04/2023
236,237,GALAWAY PURE LIQUID PARAFIN,04-7793,LIQUID PARAFIN 1G/ML,LIQUID 1 X 200ML,"SKG PHARM LTD 7/9 SAPARA STREET IKEJA, LAGOS STATE","SKG PHARM LTD 7/9 SAPARA STREET IKEJA, LAGOS STATE ,NIGERIA",04/04/2018,03/04/2023
237,238,NGC-VALGIN TABLET,04-2372,PARACETAMOL 500MG,TABLET 1 X 10 X 100,"NIGERIAN GERMAN CHEMICALS PLC KM 38, LAGOS-IBADAN EXPRESSWAY, OTA, OGUN STATE","NIGERIAN GERMAN CHEMICALS PLC KM 38, LAGOS-IBADAN EXPRESSWAY, OTA, OGUN STATE ,NIGERIA",04/04/2018,03/04/2023
238,239,TABALON 400 TABLET,04-0758,IBUPROFEN 400MG,TABLET 10 X 10,"NIGERIAN GERMAN CHEMICALS PLC KM 38, LAGOS-IBADAN EXPRESSWAY, OTA, OGUN STATE","NIGERIAN GERMAN CHEMICALS PLC KM 38, LAGOS-IBADAN EXPRESSWAY, OTA, OGUN STATE ,NIGERIA",04/04/2018,03/04/2023
239,240,NICHBEN COUGH SYRUP,04-1291,"DIPHENHYDRAMINE HCL 12.5MG, SODIUM CITRATE 50MG, AMMONIUM CHLORIDE 100MG, MENTHOL 1.0MG",SYRUP X 100ML,"NICHBEN PHARMACEUTICALS LIMITED KM. 25-26, OWERRI/ONITSHA ROAD, AWO- OMAMMA, IMO STATE","NICHBEN PHARMACEUTICALS LIMITED KM. 25- 26, OWERRI/ONITSHA ROAD, AWO- OMAMMA, IMO STATE ,NIGERIA",04/04/2018,03/04/2023
240,241,SALBUTAMOL TABLET,04-0062,SALBUTAMOL 4MG,"TABLET, X 500","VITABIOTICS NIG LTD 35 MOBOLAJI JOHNSON AVENUE, OREGUN INDUSTRIAL ESTATE, IKEJA, LAGOS STATE","VITABIOTICS NIG LTD 35 MOBOLAJI JOHNSON AVENUE, OREGUN INDUSTRIAL ESTATE, IKEJA, LAGOS STATE ,NIGERIA",09/02/2018,08/02/2023
241,242,COPTRINE SUSPENSION,04-7237,"TRIMETHOPRIM 40MG, SULPHAMETHOXAZ OLE 200MG/ 5ML","SUSPENSION, X 50ML","DRUGFIELD PHARM LTD LYNSION CHEMICAL AVENUE, KM 38 LAGOS ABEOKUTA EXPRESSWAY, SANGO-OTA, OGUN STATE","DRUGFIELD PHARM LTD LYNSION CHEMICAL AVENUE, KM 38 LAGOS ABEOKUTA EXPRESSWAY, SANGO-OTA, OGUN STATE ,NIGERIA",09/02/2018,08/02/2023
242,243,COPTRINE TABLET,04-7720,"TRIMETHOPRIM 80MG, SULPHAMETHOXAZ OLE 400MG","TABLET, 10 X 10, X 1000","DRUGFIELD PHARM LTD LYNSION CHEMICAL AVENUE, KM 38 LAGOS ABEOKUTA EXPRESSWAY, SANGO-OTA, OGUN STATE","DRUGFIELD PHARM LTD LYNSION CHEMICAL AVENUE, KM 38 LAGOS ABEOKUTA EXPRESSWAY, SANGO-OTA, OGUN STATE ,NIGERIA",09/02/2018,08/02/2023
243,244,NOSPAMIN DROPS,04-0210,HOMATROPINE METHYNROMIDE 2MG/ ML,"DROPS, X 15ML","AFRAB CHEM LTD 22 ABIMBOLA STREET, ISOLO INDUSTRIAL ESTATE, ISOLO, LAGOS STATE","AFRAB CHEM LTD 22 ABIMBOLA STREET, ISOLO INDUSTRIAL ESTATE, ISOLO, LAGOS STATE ,NIGERIA",09/02/2018,08/02/2023
244,245,NOSPAMIN TABLET,04-0898,HOMATROPINE METHYNROMIDE 10MG,"TABLET, X 500","AFRAB CHEM LTD 22 ABIMBOLA STREET, ISOLO INDUSTRIAL ESTATE, ISOLO, LAGOS STATE","AFRAB CHEM LTD 22 ABIMBOLA STREET, ISOLO INDUSTRIAL ESTATE, ISOLO, LAGOS ,NIGERIA",09/02/2018,08/02/2023
245,246,JUHEL STERILE WATER FOR INJECTION,04-6442,WATER,"LIQUID, X 10ML","JUHEL NIG LTD PLOT PD/5 EXECUTIVE BUSINESS LAYOUT, AWKA, ANAMBRA STATE","JUHEL NIG LTD PLOT PD/5 EXECUTIVE BUSINESS LAYOUT, AWKA, ANAMBRA STATE ,NIGERIA",09/02/2018,08/02/2023
246,247,GASCOL ANTACID SUSPENSION,04-6546,"MAGALDRATE 540MG, SIMETHICONE 100MG",SUSPENSION X 150ML,"FIDSON HEALTHCARE PLC KM. 38, LAGOS- ABEOKUTA EXPRESSWAY, SANGO OTA, OGUN STATE.","FIDSON HEALTHCARE PLC KM. 38, LAGOS- ABEOKUTA EXPRESSWAY, SANGO OTA, OGUN STATE. ,NIGERIA",27/02/2018,26/02/2023
247,248,POLYCIL ANTACID,04-7017,"ACTIATED POLYMETHISLOXAN E 125MG, MAGNESIUM HYDROXIDE 100MG, ALUMINIUM HYDROXIDE GEL 4.70ML",SUSPENSION X 200ML,"THERAPEUTICS LABORATORIES NIGERIA LIMITED 372, IKORODU ROAD-MENDE, MARYLAND, IKEJA, LAGOS STATE","THERAPEUTICS LABORATORIES NIGERIA LIMITED 372, IKORODU ROAD-MENDE, MARYLAND, IKEJA, LAGOS STATE ,NIGERIA",27/02/2018,26/02/2023
248,249,DR. MEYER'S LIQUID IRON,04-1155,"FERRIC AMMONIUM CITRATE 200MG, FOLIC ACID 200MCG, VITAMIN B12 MCG","SYRUP X 100ML, 200ML","ADLER PRODUCTS LIMITED 32,, ODUYEMI STREET, IKEJA, LAGOS STATE","FARMEX MEYER LIMITED ,NIGERIA",27/02/2018,26/02/2023
249,250,NICHBEN PARACETAMOL SYRUP,04-0835,PARACETAMOL 125MG,SYRUP X 60ML,"PHOENIX SPECIALTIES NIGERIA LIMITED 25/26 KM, AWO- OMAMMA,OWERRI- ONITSHA ROAD, IMO STATE","NICHBEN PHARMACEUTICALS IND. LTD. KM. 25- 26, OWERRI/ONITSHA ROAD, AWO- OMMAMMA, IMO STATE. ,NIGERIA",27/02/2018,26/02/2023
250,251,CATANIL SYRUP,A 4-5679,"PARACETAMOL 125MG, CHLORPHENIRAMIN E MALEATE 2MG/ 5ML","SYRUP, X 100ML","OAK FAITH PHARM RESOURCES LTD 10- 12 JALOGUN PALACE WAY, OFF KM 44 LAGOS- IBADAN EXPRESWAY, IMELA- NLA, MOWE, OGUN STATE","OAK FAITH PHARM RESOURCES LTD 10- 12 JALOGUN PALACE WAY, OFF KM 44 LAGOS- IBADAN EXPRESWAY, IMELA- NLA, MOWE, OGUN STATE ,NIGERIA",28/06/2018,27/06/2023
251,252,FIDSON PARACETAMOL SYRUP A4- 1304,A4-1304,PARACETAMOL 125MG /5ML,"SYRUP, X 60ML","FIDSON HEALTHCARE PLC KM 38 LAGOS- ABEOKUTA EXPRESSWAY, SANGO-OTA, OGUN STATE","FIDSON HEALTHCARE PLC KM 38 LAGOS- ABEOKUTA EXPRESSWAY, SANGO-OTA, OGUN STATE ,NIGERIA",28/06/2018,27/06/2023
252,253,TABUFEN SUSPENSION,A4-2885,IBUPROFEN 100MG/ 5ML,"SUSPENSION, X 100ML","FIDSON HEALTHCARE PLC KM 38 LAGOS- ABEOKUTA EXPRESSWAY, SANGO-OTA, OGUN STATE","FIDSON HEALTHCARE PLC KM 38 LAGOS- ABEOKUTA EXPRESSWAY, SANGO-OTA, OGUN STATE ,NIGERIA",28/06/2018,27/06/2023
253,254,CUREGOLD CYPROHEPTADI NE TABLET,A4-8554,CYPROHEPTADINE HYDROCHLORIDE 4MG,TABLET 3 X 10,"UNICURE PHARMACEUTICAL CO. LTD IKOFA VILLAGE LAGOS- BENIN EXPRESSWAY IJEBU- ODE, OGUN STATE","SAME AS APPLICANT SAME AS APPLICANT ,NIGERIA",28/06/2018,27/06/2023
254,255,EX5 DIAZEPAM TABLET,A4-8557,DIAZEPAM 5MG,TABLET 20 X 10,"UNICURE PHARMACEUTICAL CO. LTD IKOFA VILLAGE LAGOS- BENIN EXPRESSWAY IJEBU- ODE, OGUN STATE","UNICURE PHARMACEUTICAL CO. LTD IKOFA VILLAGE LAGOS- BENIN EXPRESSWAY IJEBU- ODE, OGUN STATE ,NIGERIA",28/06/2018,27/06/2023
255,256,PARAUNIC EXTRA CAPLET,A4-7122,"PARACETAMOL 500MG, CAFFEINE 30MG",CAPLET 2 X 10,"UNICURE PHARMACEUTICAL CO. LTD IKOFA VILLAGE LAGOS- BENIN EXPRESSWAY IJEBU- ODE, OGUN STATE","UNICURE PHARMACEUTICAL CO. LTD IKOFA VILLAGE LAGOS- BENIN EXPRESSWAY IJEBU- ODE, OGUN STATE ,NIGERIA",28/06/2018,27/06/2023
256,257,NIFECURE TABLET,A4-8543,NIFEDIPINE 20MG,TABLET 3 X 10,"UNICURE PHARMACEUTICAL CO. LTD IKOFA VILLAGE LAGOS- BENIN EXPRESSWAY IJEBU- ODE, OGUN STATE","UNICURE PHARMACEUTICAL CO. LTD IKOFA VILLAGE LAGOS- BENIN EXPRESSWAY IJEBU- ODE, OGUN STATE ,NIGERIA",28/06/2018,27/06/2023
257,258,TITAN LIQUID ANTISEPTIC,A4-0050,"CHLORHEXIDINE GLUCONATE 0.3% W/V, CETRIMIDE 3.0% W/V",LIQUID X 250ML,"SEE-BEST PHARM. CHEMISTS LIMITED KM. 3, NKPOR- UMUOJI ROAD, NKPOR, IDEMILI NORTH, ANAMBRA STATE","SEE-BEST PHARM. CHEMISTS LIMITED KM. 3, NKPOR- UMUOJI ROAD, NKPOR, IDEMILI NORTH, ANAMBRA STATE ,NIGERIA",28/06/2018,27/06/2023
258,259,GACID-M,A4-3782,"MAGNESIUM TRISILICATE 250MG, SODIUM BICARBONATE 250MG, LIGHT MAGNESIUM CARBONATE 250MG",SUSPENSION X 200ML,"SEE-BEST PHARM. CHEMISTS LIMITED KM. 3, NKPOR- UMUOJI ROAD, NKPOR, IDEMILI NORTH, ANAMBRA STATE","SEE-BEST PHARM. CHEMISTS LIMITED KM. 3, NKPOR- UMUOJI ROAD, NKPOR, IDEMILI NORTH, ANAMBRA STATE ,NIGERIA",28/06/2018,27/06/2023
259,260,BIORACEE TABLETS,A4-0955,ASCORBIC ACID 1000MG,TABLETS X 1000,"BIORAJ PHARMACEUTICALS LIMITED NO. 405, KAIAMA ROAD, ILORIN, KWARA STATE","BIORAJ PHARMACEUTICALS LIMITED NO. 405, KAIAMA ROAD, ILORIN, KWARA STATE ,NIGERIA",28/06/2018,27/06/2023
260,261,ZESTUP VITAMIN B- COMPLEX SYRUP,A4-4946,"VITAMIN B1 5MG, VITAMIN B2 2MG, VITAMIN B6 2MG, NICOTINAMIDE 20MG",SYRUP X 100ML,"ME CURE INDUSTRIES LIMITED DEBO INDUSTRIAL COMPOUND, PLOT NO. 6, BLOCK H, OSHODI INDUSTRIAL SCHEME, LAGOS STATE","ME CURE INDUSTRIES LIMITED DEBO INDUSTRIAL COMPOUND, PLOT NO. 6, BLOCK H, OSHODI INDUSTRIAL SCHEME, LAGOS STATE ,NIGERIA",28/06/2018,27/06/2023
261,262,KACHAM CAPLETS,A4-0486,"CHLORZOXAZONE 250MG, DICLOFENAC SODIUM 50MG, PARACETAMOL 325MG",CAPLETS X 20,"KUNIMED PHARMACHEM LIMITED 1, ADELANWA STREET, VALLEY ESTATE, DOPEMU, IKEJA, LAGOS STATE","KUNIMED PHARMACHEM LIMITED 1, ADELANWA STREET, VALLEY ESTATE, DOPEMU, IKEJA, LAGOS STATE ,NIGERIA",28/06/2018,27/06/2023
262,263,VIVA TONIC GINSENG+MUL TIVITAMINS,A4-4304,"KOREAN GINSENG EXTRACT 40MG, FERROUS FUMARATE 45.539MG, THIAMINE HYDROCHLORIDE 3.5MG, RIBOFLAVIN 1MG, PYRIDOXIDE HYDROCHLORIDE 2MG, NICOTINAMIDE 15MG, CALCIUM D- PANTOTHENATE 6MG, CYANOCOBALAMIN 2MCG",LIQUID X 200ML,"SKG PHARMA LIMITED 7/9, SAPARA STREET, IKEJA, LAGOS STATE","SKG PHARMA LIMITED 7/9, SAPARA STREET, IKEJA, LAGOS STATE ,NIGERIA",28/06/2018,27/06/2023
263,264,BISACURE TABLETS,A4-8553,BISACODYL 5MG,TABLETS X 10 X 10,"UNICURE PHARMACEUTICAL CO. LTD. IKOFA VILLAGE, LAGOS- BENIN EXPRESSWAY, IJEBU ODE, OGUN STATE","UNICURE PHARMACEUTICAL CO. LTD. IKOFA VILLAGE, LAGOS- BENIN EXPRESSWAY, IJEBU ODE, OGUN STATE ,NIGERIA",28/06/2018,27/06/2023
264,265,WORMEXP ALBENDAZOLE SUSPENSION,A4 - 1201,ALBENDAZOLE 100MG,SYRUP 20ML,"JUHEL NIGERIA LIMITED 35, NKWUBOR ROAD EMENE- ENUGU BOITE 1549 G.P.P ENUGU STATE.","JUHEL NIGERIA LIMITED 35, NKWUBOR ROAD EMENE- ENUGU BOITE 1549 G.P.P ENUGU STATE. ,NIGERIA",28/06/2018,27/06/2023
265,266,PREDNISOLONE TABLET,A4 - 2185,PREDNISOLONE 5MG,TABLET 10 X 10,"NEW DIVINE FAVOUR PHARMACEUTICAL INDUSTRIES LTD NO 7 NEW DIVINE STREET ADEGBE LAYOUT, AKUZU, NKPOR ANAMBRA STATE.","NEW DIVINE FAVOUR PHARMACEUTICAL INDUSTRIES LTD NO 7 NEW DIVINE STREET ADEGBE LAYOUT, AKUZU, NKPOR ANAMBRA STATE. ,NIGERIA",28/06/2018,27/06/2023
266,267,NEW DIVINE- 400 TABLET,A4 - 2183,CIMITIDINE 400MG,TABLET X20,"NEW DIVINE FAVOUR PHARMACEUTICAL INDUSTRIES LTD NO 7 NEW DIVINE STREET ADEGBE LAYOUT, AKUZU, NKPOR ANAMBRA STATE.","NEW DIVINE FAVOUR PHARMACEUTICAL INDUSTRIES LTD NO 7 NEW DIVINE STREET ADEGBE LAYOUT, AKUZU, NKPOR ANAMBRA STATE. ,NIGERIA",28/06/2018,27/06/2023
267,268,DIVASORAL TABLET,A4 - 2186,KETOCONAZOLE 200MG,TABLET 3 X 10,"NEW DIVINE FAVOUR PHARMACEUTICAL INDUSTRIES LTD NO 7 NEW DIVINE STREET ADEGBE LAYOUT, AKUZU, NKPOR ANAMBRA STATE.","NEW DIVINE FAVOUR PHARMACEUTICAL INDUSTRIES LTD NO 7 NEW DIVINE STREET ADEGBE LAYOUT, AKUZU, NKPOR ANAMBRA STATE. ,NIGERIA",28/06/2018,27/06/2023
268,269,DIVAGYL 400 TABLET,A4 - 2668,METRONIDAZLE 400MG,TABLET 10 X 10,"NEW DIVINE FAVOUR PHARMACEUTICAL INDUSTRIES LTD NO 7 NEW DIVINE STREET ADEGBE LAYOUT, AKUZU, NKPOR ANAMBRA STATE.","NEW DIVINE FAVOUR PHARMACEUTICAL INDUSTRIES LTD NO 7 NEW DIVINE STREET ADEGBE LAYOUT, AKUZU, NKPOR ANAMBRA STATE. ,NIGERIA",28/06/2018,27/06/2023
269,270,NEW DIVINE COLD CAPSULES,A4 - 3937,"CHLORPHENIRAMIN E MALEATE 2MG, PHENYLEPHRINE HCL 5MG",TABLET X 100,NEW DIVINE FAVOUR PHARMACEUTICAL INDUSTRIES LTD NO 7 NEW DIVINE STREET ADEGBE LAYOUT AKUZU NKPOR ANAMBRA STATE,"NEW DIVINE FAVOUR PHARMACEUTICAL INDUSTRIES LTD NO 7 NEW DIVINE STREET ADEGBE LAYOUT, AKUZU, NKPOR ANAMBRA STATE. ,NIGERIA",28/06/2018,27/06/2023
270,271,NEW DIVINE CIMETIDINE TABLET,A4 - 2184,CIMETIDINE 200MG,TABLET X 20,NEW DIVINE FAVOUR PHARMACEUTICAL INDUSTRIES LTD NO 7 NEW DIVINE STREET ADEGBE LAYOUT AKUZU NKPOR ANAMBRA STATE,"NEW DIVINE FAVOUR PHARMACEUTICAL INDUSTRIES LTD NO 7 NEW DIVINE STREET ADEGBE LAYOUT AKUZU NKPOR ANAMBRA STATE ,NIGERIA",28/06/2018,27/06/2023
271,272,BKB VIBUMOL CAPSULE,A4 - 3923,IBUPROFEN 400MG,TABLET 2 X 10,NEW DIVINE FAVOUR PHARMACEUTICAL INDUSTRIES LTD NO 7 NEW DIVINE STREET ADEGBE LAYOUT AKUZU NKPOR ANAMBRA STATE,"NEW DIVINE FAVOUR PHARMACEUTICAL INDUSTRIES LTD NO 7 NEW DIVINE STREET ADEGBE LAYOUT AKUZU NKPOR ANAMBRA STATE ,NIGERIA",28/06/2018,27/06/2023
272,273,TRAMADOL CAPSULE,A4 - 8708,TRAMADOL HYDROCHLORIDE 50MG,CAPSULE 10 X 10,"DRUGFIELD PHARMACEUTICALS LIMITED LYNSON CHEMICAL AVENUE, KM 38, LAGOS- ABEOKUTA EXPRESSWAY SANGO-OTTA, OGUN STATE, NIGERIA","DRUGFIELD PHARMACEUTICALS LIMITED LYNSON CHEMICAL AVENUE, KM 38, LAGOS- ABEOKUTA EXPRESSWAY SANGO-OTTA, OGUN STATE, NIGERIA ,NIGERIA",28/06/2018,27/06/2023
273,274,DANA LAM,A4 - 9117,IBUPROFEN 100MG,SUSPENSION 100ML,"DANA PHARMACEUTICAL LTD SHIRORO DAM ROAD,MAITUMBI MINNA NIGER STATE","DANA PHARMACEUTICAL LTD SHIRORO DAM ROAD,MAITUMBI MINNA NIGER STATE ,NIGERIA",28/06/2018,27/06/2023
274,275,NEW DIVINE VIBUMOL TABLETS,A4-2654,,TABLETS X 2 X 4,"NEW DIVINE FAVOUR PHARMACEUTICALS INDUSTRIES LIMITED NO. 7, NEW DIVINE STREET, ADEGBE LAYOUT, AKUZOR NKPOR, ANAMBRA STATE","NEW DIVINE FAVOUR PHARMACEUTICALS INDUSTRIES LIMITED NO. 7, NEW DIVINE STREET, ADEGBE LAYOUT, AKUZOR NKPOR, ANAMBRA STATE ,NIGERIA",28/06/2018,27/06/2023
275,276,DICLOFENAC GEL,A4-0707,11.6MG DICLOFENAC DIETHYLAMINEEQUI VALENT TO 10MG DICLOFENIC SODIUM) W/W,"GEL, X 20G","DRUGFIELD PHARMACEUTICALS LIMITED LYNSON CHEMICAL AVENUE, KM 38, LAGOS- ABEAKUTA EXPRESSWAY, SANGO-OTA , OGUN STATE","DRUGFIELD PHARMACEUTICALS LIMITED LYNSON CHEMICAL AVENUE, KM 38, LAGOS- ABEAKUTA EXPRESSWAY, SANGO-OTA , OGUN STATE ,NIGERIA",28/06/2018,27/06/2023
276,277,Axitin 625Mg Tablet,A4-3960,Amoxicillin 500Mg & Clavulanic Acid 125Mg.,Tablets Pom/2X7's,"Clarion Medicals Ltd, 23A, Afolabi Str, Ilupeju, Lagos","Reyoung Pharm Co. Ltd No 6 Erlangshan Rd, Yiyuan County, Shandong Province, China. ,CHINA",29/01/2016,28/01/2021
277,278,Amaryl 3Mg Tablet,A4-3074,Glimepiride 3Mg,Pom/ 2X 15'S,"Sanofi Aventis Nig Ltd. Japaul House Plot 8, Nurudeen Olowopopo Avenue Ikeja Cbd Agidingbi","Sanofi Aventis S.P.A Ss 17Km 22 67019 Scoppito (Ag) Italy. ,ITALY",28/01/2016,27/01/2021
278,279,COLESTRIM TABLET,A4-1962,FENOFIBRATE 160MG,TABLET/1X3X10,"MEGA LIFESCIENCES NIG LTD. 68, METAL HOUSE, COCOA IND. ROAD OGBA, LAGOS STATE","INVENTIA HEALTHCARE PVT LTD. F1-F1/1 ADDITIONAL AMBERNATH, M.I.D.C. AMBERNATH EAST- 421 506 THANE INDIA ,INDIA",28/01/2016,27/01/2021
279,280,LIMZER CAPSULE,A4-4502,"OMEPRAZOLE 20MG BP, DOMPERIDONE SR 30MG BP",CAPSULE/1X3X10,"MEGA LIFESCIENCES NIG LTD. 68, METAL HOUSE, COCOA IND. ROAD OGBA, LAGOS STATE","INVENTIA HEALTHCARE PVT LTD. F1-F1/1 ADDITIONAL AMBERNATH, M.I.D.C. AMBERNATH EAST- 421 506 THANE INDIA ,INDIA",28/01/2016,27/01/2021
280,281,ALPHACAINE 100 INJECTION,A4-4022,"LIDOCAINE HYDROCHLORIDE 20MG/ML, EPINEPHRINE 10G/ML",INJECTION/1X100ML,"DAVONA NIGERIA LIMITED. 51, OPEBI ROAD IKEJA LAGOS","DFL INDUSTRIA E COMERCIO S.A. ESTRADA DO GUERENQUE,RIO DE JANEIRO-RJ-BRASIL ,INDIA",28/01/2016,27/01/2021
281,282,ESAM 2.5 TABLET,A4-5408,S-AMLODIPINE BESYLATE EQ TO S- AMLODIPINE 2.5MG,TABLET/3X10,"EMZOR PHARMA IND LTD PLOT 3C, BLOCK A, ASWANI MARKET ROAD ISOLO OSHODI LAGOS","TORRENT PHARMA. LTD. INDRAD-382 721, DIST. MEHSANA INDIA ,INDIA",28/01/2016,27/01/2021
282,283,AMYVIL 25 TABLET,A4-5073,AMITRIPTYLINE HYDROCHLORIDE BP 25MG,TABLETX10X10,ZOLON HEALTHCARE LIMITED. 37 OSOLO WAY ISOLO LAGOS,"BAROQUE PHARMACEUTICALS PVT LTD. SOKHADA-388 620 TA. KHAMBHAT DIST. ANAND GUJARAT INDIA ,INDIA",28/01/2016,27/01/2021
283,284,EPOEJA CAPSULE,A4-4929,COD LIVER OIL 300MG,CAPSULE/2X15,"ORJI PHARMACEUTICAL CO LTD. 15, OKEY EKEKUBI STREET, MOSAFEJO OJO LAGOS","OLIVE HEALTH CARE. 197/2 ATHIYAWAD, NEAR DABHEL VILLAGE, NANI DAMAN- 396 210 (U.T.) INDIA ,INDIA",28/01/2016,27/01/2021
284,285,MIRAVASC-10 TABLET,A4-4359,AMLODIPINE BESILATE BP EQ TO AMLODIPINE 10MG,TABLET/2X14,"MIRAFLASH NIG LTD. NO 1 BOSUN OKUNOWO ESTATE, OFF OLAMBE ROAD OLAMBE OGUN STATE","STALLION LABORATORIES PVT LTD. C-1B, 305/2&3, GIDC, KERALA (BAVLA) DIST: AHMEDABEAD GUJARAT INDIA ,INDIA",28/01/2016,27/01/2021
285,286,TRANAZOLE- 100 CAPSULE,A4-4081,ITRACONAZOLE BP 100MG,CAPSULE/1X10,"BARATA PHARMACEUTICALS & CO. LTD. 416, IKWERRE ROAD, PORT HARCOURT, NIGERIA","STALLION LABORATORIES PVT LTD. C-1B, 305/2&3, GIDC, KERALA (BAVLA) DIST: AHMEDABEAD GUJARAT INDIA ,INDIA",28/01/2016,27/01/2021
286,287,MIRAVASC-5 TABLET,A4-4358,AMLODIPINE BESILATE BP EQ TO AMLODIPINE 5MG,TABLET/2X14,"MIRAFLASH NIG LTD. NO 1 BOSUN OKUNOWO ESTATE, OFF OLAMBE ROAD OLAMBE OGUN STATE","STALLION LABORATORIES PVT LTD. C-1B, 305/2&3, GIDC, KERALA (BAVLA) DIST: AHMEDABEAD GUJARAT INDIA ,INDIA",28/01/2016,27/01/2021
287,288,VIPRAX CAPSULE,A4-4473,OMEPRAZOLE BP 20MG,CAPSULE/2X7,"VINCO PHARMA NIGERIA LIMITED. 4B, DUPE OTEGBOLA STREET, NAVY BARRACKS, STAELLITE TOWN LAGOS NIGERIA","MCW HEALTHCARE (P) LTD. 286, 287-A, 287-B, SEC-E, INDUSTRIAL AREA, SANWER ROAD, INDORE (M.P.) INDIA ,INDIA",28/01/2016,27/01/2021
288,289,STARCOD CAPSULE,A4-6279,COD LIVER OIL 300MG,CAPSULE/2X15,"MORESTAR PHARMACEUTICAL LTD. 73, IJESHA ROAD, SURULERE LAGOS","RENOWN PHARMACEUTICALS PVT LTD. SURVEY NO 143/A &B, VILLAGE RANU, TALUKA-PADRA, DIST-VADODARA- 391 445 (GUJARAT) INDIA ,INDIA",28/01/2016,27/01/2021
289,290,ABACAVIR SULFATE/LAMIV UDINE TABLET,A4-3123,"ABACAVIR SULPHATE 60MG, LAMIVUDINE 30MG",TABLET/1X60,"HEALTHLINE NIGERIA LTD 1A, ODUNAYO ADEYEMI CLOSE, OFF EMMANUEL KESHI STREET, MAGODO GRA SHANGISHA LAGOS","MYLAN LABORATORIES LTD. F-4 & F-12, MIDC, MALEGAON SINNAR, NASHIK- 422 113, MAHARASHTRA INDIA ,INDIA",25/02/2016,24/02/2021
290,291,DEXORANGE CAPSULE,A4-0862,"IRON, FOLIC ACID AND VITAMIN B12",CAPSULE/1X30,NAFRO PHARM NIG LTD SUITE B16 AMORI SHOPPING PLAZA EGBEDA LAGOS,"FRANCO-INDIAN PHARMACEUTICALS PVT LTD 20, DR, E. MOSES ROAD, MUMBAI-400 011 INDIA ,INDIA",25/02/2016,24/02/2021
291,292,TRAMACET INJECTION,A4-0251,TRAMADOL HYDROCHLORIDE BP 50MG,INJECTION/10X2ML,"MERIT HEALTHCARE LIMITED IYA-OBA HOUSE, 10 DELE ASHIRU STREET IRE- AKARI ESTATE ISOLO LAGOS","CIRON DRUGS & PHARMACEUTICALS PVT LTD. N- 118/119, MIDC, TARAPUR, BOISAR, DIST. THANE-401 506 INDIA ,INDIA",25/02/2016,24/02/2021
292,293,OCTAMIN SUSPENSION,A4-4112,CARBONYL IRON EQ TO ELEMENTAL IRON 60MG WITH VITAMIN B12 5MCG AND VITAMIN E 15 IU,SYRUP/1X200ML,"VIXA PHARMACEUTICAL CO. LTD 13B SUNNY JIGIDE STREET, OFF CELESTIAL WAY, OGUDU LAGOS","ENICAR PHARMACEUTICALS PVT LTD J-214, 215, MIDC, TARAPUR, BOISAR-401 506, MAHARASHTRA INDIA ,INDIA",25/02/2016,24/02/2021
293,294,CIMEC 200 TABLET,A4-1924,CIMETIDINE BP 200MG,TABLET/1X20,"CLIMAX PHARMA CHEM LTD 62 ABA ROAD S/GARI KANO, KANO STATE","ZIM LABORATORIES LTD B-21/22 M.I.D.C AREA, KALMESHWAR NAGPUR 441 501 INDIA ,INDIA",05/04/2016,04/04/2021
294,295,CIMEC 400 TABLET,A4-1923,CIMETIDINE BP 400MG,TABLET/1X20,"CLIMAX PHARMA CHEM LTD 62 ABA ROAD S/GARI KANO, KANO STATE","ZIM LABORATORIES LTD B-21/22 M.I.D.C AREA, KALMESHWAR NAGPUR 441 501 INDIA ,INDIA",05/04/2016,04/04/2021
295,296,MAKINGA OMEPRAZOLE CAPSULE,A4-2549,OMEPRAZOLE BP 20MG,CAPSULE/2X7,"MAKINGA PHARM & MULTISCIENCE LTD 33, OLATUNJI STREET, OFF ROJU AVENUE, OJOTA LAGOS NIGERIA","SUNIJ PHARMA PVT LTD 4228-30, GIDC, PHASE IV, VATVA, AHMEDABAD-382 445 INDIA ,INDIA",05/04/2016,04/04/2021
296,297,FRAFENAC 50 CAPSULE,A4-2688,DICLOFENAC POTASSIUM BP 50MG,TABLET/10X10,"FRANPHINO PHARM CO. LTD 44, MOSALASHI STREET, MUSHIN LAGOS","SAGA LABORATORIES PLOT NO. 1409 PHASE-III GIDC ESTATE VATVA, AHMEDABAD- 382 445 INDIA ,INDIA",05/04/2016,04/04/2021
297,298,FLUCOPHIN ORAL SUSPENSION,A4-2788,FLUCONAZOLE USP 50MG/5ML,POWDER/1X35ML,"FRANPHINO PHARM CO. LTD 44, MOSALASHI STREET, MUSHIN LAGOS","SAGA LABORATORIES PLOT NO. 1409 PHASE-III GIDC ESTATE VATVA, AHMEDABAD- 382 445 INDIA ,INDIA",05/04/2016,04/04/2021
298,299,AZITHROPHIN- 500 CAPSULES,A4-2712,AZITHROMYCIN BP 500MG,CAPSULE/1X6,"FRANPHINO PHARM CO. LTD 44, MOSALASHI STREET, MUSHIN LAGOS","SAGA LABORATORIES PLOT NO. 1409 PHASE-III GIDC ESTATE VATVA, AHMEDABAD- 382 445 INDIA ,INDIA",05/04/2016,04/04/2021
299,300,JAWAZINE CAPSULE,A4-4377,CETIRIZINE HYDROCHLORIDE BP 10MG,CAPSULE/1X10,"JAWA INTERNATIONAL LTD PLOT NO 6 ABIMBOLA WAY, ISOLO INDUSTRIAL ESTATE ISOLO LAGOS","GUJARAT LIQUI PHARMACAPS PVT LTD PLOT NO 662- 666, GIDC WAGHODIA, VADODARA- 391 760, GUJARAT INDIA ,INDIA",05/04/2016,04/04/2021
300,301,AMILOD-10 TABLET,A4-2405,AMLODIPINE BESILATE BP EQ TO AMLODIPINE 10MG,TABLET/10X10,"GRINVISION NIGERIA LIMITED PLOT 11, BLOCK 86A EMMA ABIMBOLA COLE STREET, LEKKI PHASE 1 LAGOS NIGERIA","STALLION LABORATORIES PVT LTD C-1B, 305/2 & 3, GIDC, KERALA (BAVLA) DIST. AHMEDABAD 382 220 INDIA ,INDIA",05/04/2016,04/04/2021
301,302,GRINFLAM TABLET,A4-2510,DICLOFENAC POTASSIUM USP 50MG,TABLET/10X10,"GRINVISION NIGERIA LIMITED PLOT 11, BLOCK 86A EMMA ABIMBOLA COLE STREET, LEKKI PHASE 1 LAGOS NIGERIA","STALLION LABORATORIES PVT LTD. C-1B, 305/2 & 3, GIDC, KERALA (BAVLA) DIST. AHMEDABAD 382 220 INDIA ,INDIA",05/04/2016,04/04/2021
