,S/N,NAME OF PRODUCT,NAFDAC REG. NO,COMPOSITION,"DOSAGE FORM, PRESENTATION",NAME & ADDRESS OF APPLICANT,NAME AND ADDRESS OF MANUFACTURER,APPROVAL DATE,EXPIRY DATE
0,1,MYCONYS,A11-0671,NYSTATIN,"SUSPENSION, X",JAWA INTL,JAWA INTL LTD,28/06/2018,27/06/2023
1,2,ACETYSALI,A11-0672,1A0C0E0T00YIULS/ AMLLICYC,"3T0AMBLLET, 3 X 10",LETCDO M PELDO T 6,PELCOOTM 6E DA BPIHMABROML A,28/06/2018,27/06/2023
2,3,CPAYNLDICA A CID EXTRA CAPLET,A11-0673,"LPAICR AACCIEDT 7A5MMOGL 500MG, CAFFEINE 30MG","CAPLET, 2 X 10","PAHFARARBM CLHTEDM LTD 22 ABIMBOLA STREET, ISOLO INDUSTRIAL ESTATE, ISOLO, LAGOS STATE","LATFDRA PBL COHT E3M2 LTD 22 ABIMBOLA STREET, ISOLO INDUSTRIAL ESTATE, ISOLO, LAGOS STATE ,NIGERIA",28/06/2018,27/06/2023
3,4,ACTIFLU SYRUP,A11-0674,"TRIPROLIDINE HCL 1.25MG/5ML, PSEUDOEPHEDRI NE HCL 30MG/5ML",SYRUP X 50ML,"JUHEL NIGERIA LIMITED 35, NKWUBOR ROAD, EMENE- ENUGU, ENUGU STATE","JUHEL NIGERIA LIMITED 35, NKWUBOR ROAD, EMENE-ENUGU, ENUGU STATE ,NIGERIA",28/06/2018,27/06/2023
4,5,METRONE IV INFUSION,A11-0242,METRONIDAZOLE 500MG /100ML,"INTRAVENOUS INFUSION, X 100ML","FIDSON HEALTHCARE PLC KM 38 LAGOS- ABEOKUTA EXPRESSWAY, SANGO-OTA, OGUN STATE","FIDSON HEALTHCARE PLC KM 38 LAGOS- ABEOKUTA EXPRESSWAY, SANGO-OTA, OGUN STATE ,NIGERIA",28/06/2018,27/06/2023
5,6,CHEMOVITE SYRUP,A11-0675,"VIT A 5000IU, VIT B1 2.5MG, VIT B2 1MG, VIT B6 1MG, VIT C 50MG, VIT D2 1000IU, NICOTINAMIDE 10MG/ 5ML","SYRUP, X 100ML","CHEMO- PHARMA LAB LTD 13 OLANREWAJU STREET, OREGUN INDUSTRIAL ESTATE, LAGOS STATE","CHEMO-PHARMA LAB LTD 13 OLANREWAJU STREET, OREGUN INDUSTRIAL ESTATE, LAGOS STATE ,NIGERIA",28/06/2018,27/06/2023
6,7,VIKGYL SUSPENSION,A11-0676,METRONIDAZOLE 200MG/ 5ML,"SYRUP, X 60ML","CHEMO- PHARMA LAB LTD 13 OLANREWAJU STREET, OREGUN INDUSTRIAL ESTATE, LAGOS STATE","CHEMO-PHARMA LAB LTD 13 OLANREWAJU STREET, OREGUN INDUSTRIAL ESTATE, LAGOS STATE ,NIGERIA",28/06/2018,27/06/2023
7,8,ARBATEX-L TABLET,A11-0206,LOSARTAN 50MG,"TABLET, 3 X 10","PHAMATEX INDUSTRIES LTD 1 CRYSTAL GLASS CLOSE, AMUWO ODOFIN INDUSTRIAL ESTATE, LAGOS STATE","PHAMATEX INDUSTRIES LTD 1 CRYSTAL GLASS CLOSE, AMUWO ODOFIN INDUSTRIAL ESTATE, LAGOS STATE ,NIGERIA",28/06/2018,27/06/2023
8,9,IGE IODINE TINCTURE,A11-0677,"IODINE 0.025G, POTASSIUM IODIDE 0.25G, ETHYL ALCOHOL QS","SOLUTION, X 15ML","IGE PHARMACY NIG LTD UNIT II TECHOLOGY INCUBATION CENTRE AJILOSUN, ADO EKITI, EKITI STATE","IGE PHARMACY NIG LTD UNIT II TECHOLOGY INCUBATION CENTRE AJILOSUN, ADO EKITI, EKITI STATE ,NIGERIA",28/06/2018,27/06/2023
9,10,CHIFENAC CAPSULES,A11-0678,"PARACETAMOL BP 500MG, DICLOFENAC SODIUM 25MG","CAPSULES, 2 X12","VADIS PHARMA LTD PLOT RD 14 TRANS EKULU ENUGU, ENUGU STATE","VADIS PHARMA LTD PLOT RD 14 TRANS EKULU ENUGU, ENUGU STATE ,NIGERIA",28/06/2018,27/06/2023
10,11,JOPAN CIMETIDINE- 400 TABLET A11-0679,A11-0679,CIMETIDINE 400MG,"TABLET, 1 X 20","JOPAN PHARMA NIG LTD 13, CHINEDU OKAFOR STREET, AJAO ESTATE, ISOLA LAGOS STATE.","JOPAN PHARMA NIG LTD 13, CHINEDU OKAFOR STREET, AJAO ESTATE, ISOLA LAGOS STATE. ,NIGERIA",28/06/2018,27/06/2023
11,12,CHEMOLIN LINCTUS,A11-0680,"CHLORPHENIRAM I N E M A L E A T E B P 2MG, AMMONIUM BICARBONATE BP 150MG, MENTHOL 1.1MG","SYRUP, 100ML","CHEMO- P H A R M A L A B LTD GREAT CLARENDON COURT: 13, OLANREWAJU STREET, OREGUN INDUSTRIAL ESTATE LAGOS STATE","CHEMO-PHARMA L A B L T D G R E A T CLARENDON COURT: 13, OLANREWAJU STREET, OREGUN INDUSTRIAL ESTATE LAGOS STATE ,NIGERIA",28/06/2018,27/06/2023
12,13,AVRO ASPIRIN TABLET,A11-0681,ACETYLSALICYLI C ACID 300MG,TABLET X 1000,"AVRO PHARMA LTD DAID HOUSE, PLOT2, BLOCK J LIMCA WAY, ISOLO INDUSTRIAL ESTATE ESTATE, OSHODI APAPA EXPRESSWAY, ISOLO, LAGOS STATE","SKG-PHARMA LIMITED 7/9, SAPARA STREET IKEJA LAGOS STATE ,NIGERIA",28/06/2018,27/06/2023
13,14,TIMLOL 0.25% EYE DROP,A11-0229,TIMOLOL 0.25% W/V,"DROPS, 10MLS","FIDSON HEAITH CARE PLC KM, 38, LAGOS- ABEOKUTA EXPRESS WAY SANGO-OTA OGUN STATE","FIDSON HEAITH CARE PLC KM, 38, LAGOS-ABEOKUTA EXPRESS WAY SANGO-OTA OGUN STATE ,NIGERIA",28/06/2018,27/06/2023
14,15,CARVEDILOL TABLETS,A11-0682,CARVEDILOL 6.25MG,TABLET 2 X14,"ECOMED PHARMA LIMITED PLOT 32 LYNSON CHEMICAL AVENUE KM 36, LAGOS- ABEOKUTA EXPRESSWAY SANGO OTA OGUN STATE.","ECOMED PHARMA LIMITED PLOT 32 LYNSON CHEMICAL AVENUE KM 36, LAGOS-ABEOKUTA EXPRESSWAY SANGO OTA OGUN STATE. ,NIGERIA",28/06/2018,27/06/2023
15,16,BONDPRAZ CAPSULE,A11-0683,OMEPRAZOLE 20MG,CAPSULE 2 X 7,"BOND CHEMICAL IND. LTD PLOT 20- 26 ADESOLIN LAYOUT AWE, OYO STATE","BOND CHEMICAL IND. LTD PLOT 20- 26 ADESOLIN LAYOUT AWE, OYO STATE ,NIGERIA",28/06/2018,27/06/2023
16,17,LINVASPRIL TABLETS,A11-0684,LISINOPRIL 10MG,TABLET 3 X 10,"BOND CHEMICAL IND. LTD PLOT 20- 26 ADESOLIN LAYOUT AWE, OYO STATE","BOND CHEMICAL IND. LTD PLOT 20- 26 ADESOLIN LAYOUT AWE, OYO STATE ,NIGERIA",28/06/2018,27/06/2023
17,18,TIMLOL 0.5% EYE DROP,A11-0228,TIMOLOL 0.5% W/V,"DROPS, 10MLS","FIDSON HEAITH CARE PLC KM, 38, LAGOS- ABEOKUTA EXPRESS WAY SANGO-OTA OGUN STATE","FIDSON HEAITH CARE PLC KM, 38, LAGOS-ABEOKUTA EXPRESS WAY SANGO-OTA OGUN STATE ,NIGERIA",28/06/2018,27/06/2023
18,19,ZUVIT-C TABLET,A11-0686,ASCORBIC ACID 100MG,"TABLET, X 1000","ZUNAMEDIKS PHARM LTD 16, GBC MURPHY AVENUE OFF BENIN/ ASABA EXPRESS WAY, ASABA, DELTA STATE.","ZUNAMEDIKS PHARM LTD 16, GBC MURPHY AVENUE OFF BENIN/ ASABA EXPRESS WAY, ASABA, DELTA STATE. ,NIGERIA",28/06/2018,27/06/2023
19,20,FLUCOSTAT I.V INFUSION,A11-0245,"FLUCONAZOLE 200MG, SODIUM CHLORIDE 0.9G","INTRAVENOUS INFUSION, X100ML","FIDSON HEAITH CARE PLC KM, 38, LAGOS- ABEOKUTA EXPRESS WAY SANGO-OTA OGUN STATE","FIDSON HEAITH CARE PLC KM, 38, LAGOS-ABEOKUTA EXPRESS WAY SANGO-OTA OGUN STATE ,NIGERIA",28/06/2018,27/06/2023
20,21,MYCOTEN PLUS VAGINAL TABLET,A11-0693,"CLOTRIMAZOLE 200MG, CLINDAMYCIN 100MG",TABLET X 7,"DRUGFIELD PHARMACEUTI CALS LIMITED LYNSON CHEMICAL AVENUE, KM. 38, LAGOS- IBADAN EXPRESSWAY, SANGO-OTA, OGUN STATE","DRUGFIELD PHARMACEUTICALS LIMITED LYNSON CHEMICAL AVENUE, KM. 38, LAGOS-IBADAN EXPRESSWAY, SANGO-OTA, OGUN STATE ,NIGERIA",28/06/2018,27/06/2023
21,22,FLANIZOL TABLETS,A11-0694,METRONIDAZOLE 200MG,TABLET X 10 X 10,"SEE-BEST PHARM. CHEMISTS LIMITED KM. 3, NKPOR-UMUOJI ROAD, NKPOR, IDEMILI NORTH, ANAMBRA STATE","SEE-BEST PHARM. CHEMISTS LIMITED KM. 3, NKPOR- UMUOJI ROAD, NKPOR, IDEMILI NORTH, ANAMBRA STATE ,NIGERIA",28/06/2018,27/06/2023
22,23,BENDEX PYRANTEL PAMOATE ORAL SUSPENSION,A11-0695,PYRANTEL PAMOATE 250MG/5ML,SUSPENSION X 15ML,"UNIQUE PHARMACEUTI CALS LIMITED KM. 38, ABEOKUTA ROAD, SANG- OTA, OGUN STATE","UNIQUE PHARMACEUTICALS LIMITED KM. 38, ABEOKUTA ROAD, SANG-OTA, OGUN STATE ,NIGERIA",28/06/2018,27/06/2023
23,24,AVROTON CAPSULE,A11-0696,"GINSENG EXTRACT 50.0MG, IRON 16.7MG, VITAMIN A 1000IU, VITAMIN B1 1.0MG, VITAMIN B2 1.5MG, VITAMIN B6 1.5MG, VITAMIN B12 5.0MCG, VITAMIN C 30.0MG, FOLIC ACID 2.0MG, NICOTINAMIDE 20.0MG, CALCIUM PANTOTHENATE 7.0MG, ZINC 5.0MG","CAPSULES X 3 X 10, 12 X 10","AVRO PHARMA LIMITED DAID HOUSE, PLOT 2, BLOCK J, LIMCA WAY, ISOLO INDUSTRIAL ESTATE, OSHODI-APAPA EXPRESSWAY, ISOLO, LAGOS STATE","SKG PHARMA LIMITED 7/9, SAPARA STREET, IKEJA, LAGOS STATE ,NIGERIA",28/06/2018,27/06/2023
24,25,PURIT MENTHOLAT ED BALM,A11-0697,"METHYL SALICYLATE 4G, MENTHOL 4G, PETROLEUM JELLY, MINERAL OIL, FRAGRANCE",TOPICAL CREAM X 30G,"SARO LIFECARE LIMITED PLOT 6-8, BLOCK F, OLUYOLE INDUSTRIAL ESTATE, IBADAN, OYO STATE","SARO LIFECARE LIMITED PLOT 6-8, BLOCK F, OLUYOLE INDUSTRIAL ESTATE, IBADAN, OYO STATE ,NIGERIA",28/06/2018,27/06/2023
25,26,IGE GLYCERINE BORAX,A11-0698,BORAX DECAHYDRATE 6G,LIQUID X 50ML,"IGE PHARMACY NIG. LTD. UNIT II, TECHNOLOGY INCUBATION CENTER, AJILOSUN, ADO EKITI, EKITI STATE.","IGE PHARMACY NIG. LTD. UNIT II, TECHNOLOGY INCUBATION CENTER, AJILOSUN, ADO EKITI, EKITI STATE. ,NIGERIA",28/06/2018,27/06/2023
26,27,IGE GENTIAN VIOLET,A11-0699,CRYSTAL VIOLET 1% W/V,EXT. PREP. X 60ML,"IGE PHARMACY NIG. LTD. UNIT II, TECHNOLOGY INCUBATION CENTER, AJILOSUN, ADO EKITI, EKITI STATE.","IGE PHARMACY NIG. LTD. UNIT II, TECHNOLOGY INCUBATION CENTER, AJILOSUN, ADO EKITI, EKITI STATE. ,NIGERIA",28/06/2018,27/06/2023
27,28,BARIVIT-C SYRUP,A11-0700,ASCORBIC ACID 100MG/5ML,SYRUP X 100ML,"BARKA PHARMACEUTI CAL COMPANY LIMITED NATIONAL BOARD FOR TECHNOLOGY INCUBATION (FMST) TIC SOKOTO, NO. 6, GARBA MOHAMMED ROAD, RUNJIN SAMBO AREA, SOKOTO STATE","BARKA PHARMACEUTICAL COMPANY LIMITED NATIONAL BOARD FOR TECHNOLOGY INCUBATION (FMST) TIC SOKOTO, NO. 6, GARBA MOHAMMED ROAD, RUNJIN SAMBO AREA, SOKOTO STATE ,NIGERIA",28/06/2018,27/06/2023
28,29,BARIMOL PARACETAM OL SYRUP,A11-0701,PARACETAMOL 125MG/5ML,SYRUP X 60ML,"BARKA PHARMACEUTI CAL COMPANY LIMITED NATIONAL BOARD FOR TECHNOLOGY INCUBATION (FMST) TIC SOKOTO, NO. 6, GARBA MOHAMMED ROAD, RUNJIN SAMBO AREA, SOKOTO STATE","BARKA PHARMACEUTICAL COMPANY LIMITED NATIONAL BOARD FOR TECHNOLOGY INCUBATION (FMST) TIC SOKOTO, NO. 6, GARBA MOHAMMED ROAD, RUNJIN SAMBO AREA, SOKOTO STATE ,NIGERIA",28/06/2018,27/06/2023
29,30,BARIKOFF EXPECTORA NT,A11-0702,"DIPHENHYDRAMI NE HCL 14MG, AMMONIUM CHLORIDE 132MG, MENTHOL 1.1MG",SYRUP X 100ML,"BARKA PHARMACEUTI CAL COMPANY LIMITED NATIONAL BOARD FOR TECHNOLOGY INCUBATION (FMST) TIC SOKOTO, NO. 6, GARBA MOHAMMED ROAD, RUNJIN SAMBO AREA, SOKOTO STATE","BARKA PHARMACEUTICAL COMPANY LIMITED NATIONAL BOARD FOR TECHNOLOGY INCUBATION (FMST) TIC SOKOTO, NO. 6, GARBA MOHAMMED ROAD, RUNJIN SAMBO AREA, SOKOTO STATE ,NIGERIA",28/06/2018,27/06/2023
30,31,ZUFANOL TABLET,A11-0703,"SALBUTAMOL 2MG, THEOPHYLLINE 100MG",TABLETS X 100,"ZUNAMEDIKS PHARM. LIMITED 16GBC MURPHY AVENUE, OFF BENIN/ASABA EXPRESSWAY, ASABA, DELTA STATE","ZUNAMEDIKS PHARM. LIMITED 16GBC MURPHY AVENUE, OFF BENIN/ASABA EXPRESSWAY, ASABA, DELTA STATE ,NIGERIA",28/06/2018,27/06/2023
31,32,ZUNAFED CHLORPHENI RAMINE MALEATE SYRUP,A11-0704,CHLORPHENIRAM INE MALEATE 2MG/5ML,SYRUP X 60ML,"ZUNAMEDIKS PHARM. LIMITED 16GBC MURPHY AVENUE, OFF BENIN/ASABA EXPRESSWAY, ASABA, DELTA STATE","ZUNAMEDIKS PHARM. LIMITED 16GBC MURPHY AVENUE, OFF BENIN/ASABA EXPRESSWAY, ASABA, DELTA STATE ,NIGERIA",28/06/2018,27/06/2023
32,33,ZUNAFED CHLORPHENI RAMINE MALEATE TABLETS,A11-0705,CHLORPHENIRAM INE MALEATE 4MG,TABLETS X 1000,"ZUNAMEDIKS PHARM. LIMITED 16GBC MURPHY AVENUE, OFF BENIN/ASABA EXPRESSWAY, ASABA, DELTA STATE","ZUNAMEDIKS PHARM. LIMITED 16GBC MURPHY AVENUE, OFF BENIN/ASABA EXPRESSWAY, ASABA, DELTA STATE ,NIGERIA",28/06/2018,27/06/2023
33,34,TACMED CIMETIDINE 400MG CAPLETS,A11-0706,CIMETIDINE 400MG,CAPLETS X 100,"ZUNAMEDIKS PHARM. LIMITED 16GBC MURPHY AVENUE, OFF BENIN/ASABA EXPRESSWAY, ASABA, DELTA STATE","ZUNAMEDIKS PHARM. LIMITED 16GBC MURPHY AVENUE, OFF BENIN/ASABA EXPRESSWAY, ASABA, DELTA STATE ,NIGERIA",28/06/2018,27/06/2023
34,35,ESOMEPRAZ OLE CAPSULES,A11-0707,ESOMEPRAZOLE 20MG,CAPSULES X 2 X 7,"ECOMED PHARMA. LTD. PLOT 32, LYNSON CHEMICAL AVENUE, KM. 38, LAGOS- IBADAN EXPRESSWAY, SANGO-OTA, OGUN STATE","ECOMED PHARMA. LTD. PLOT 32, LYNSON CHEMICAL AVENUE, KM. 38, LAGOS-IBADAN EXPRESSWAY, SANGO-OTA, OGUN STATE ,NIGERIA",28/06/2018,27/06/2023
35,36,AFRAB SALBUTAMO L SYRUP,A11-0709,SALBUTAMOL SULPHATE 2MG/ 5ML,"SYRUP, X 100ML","AFRAB CHEM LTD 22 ABIMBOLA STREET, ISOLO INDUSTRIAL ESTATE, ISOLO, LAGOS STATE","AFRAB CHEM LTD 22 ABIMBOLA STREET, ISOLO INDUSTRIAL ESTATE, ISOLO, LAGOS STATE ,NIGERIA",28/06/2018,27/06/2023
36,37,AC MEBEZOLE TABLET,A11-0762,MEBENDAZOLE 100MG,TABLET 20 X 6,"A.C DRUGS LTD. 4, ALOR RD.EDWARD NNAJI LAYOUT ABAKPA NIKE, ENUGU STATE","A.C DRUGS LTD. 4, ALOR RD.EDWARD NNAJI LAYOUT ABAKPA NIKE, ENUGU STATE ,NIGERIA",28/06/2018,27/06/2023
37,38,AVROPRYL TABLET,A11-0764,GLIMEPIRIDE 4MG,TABLET 3 X 10,"AVRO PHARMA LTD DAID HOUSE PLOT 2, BLOCK J, LIMCA WAY ISOLO INDUSTRIAL ESTATE OSHODI- APAPA EXPRESSWAY ISOLO, LAGOS STATE.","SKG-PHARMA LIMITED 7/9 SAPARA STREET, IKEJA, LAGOS STATE ,NIGERIA",28/06/2018,27/06/2023
38,39,GLIBENAX TABLET,A11-0765,GLIMEPIRIDE 4MG,TABLET 3 X 10,"SKG- PHARMA LIMITED 7/9 SAPARA STREET, IKEJA, LAGOS STATE","SKG- PHARMA LIMITED 7/9 SAPARA STREET, IKEJA, LAGOS STATE ,NIGERIA",28/06/2018,27/06/2023
39,40,IBUPROCEL 200 TABLET,A11-0766,IBUPROFEN 200MG,TABLET 2 X 10,"AUSCEL LABORATORIE S LTD PLOT 40799 SHINCO ROAD, MAI- ADIKO RAYFIELD JOS, PLATEAU STATE.","AUSCEL LABORATORIES LTD PLOT 40799 SHINCO ROAD, MAI- ADIKO RAYFIELD JOS, PLATEAU STATE. ,NIGERIA",28/06/2018,27/06/2023
40,41,IBUPROCEL 400 TABLET,A11-0767,IBUPROFEN 400MG,TABLET 1 X 10,"AUSCEL LABORATORIE S LTD PLOT 40799 SHINCO ROAD, MAI- ADIKO RAYFIELD JOS, PLATEAU STATE.","AUSCEL LABORATORIES LTD PLOT 40799 SHINCO ROAD, MAI- ADIKO RAYFIELD JOS, PLATEAU STATE. ,NIGERIA",28/06/2018,27/06/2023
41,42,AUSDOL 250MG TABLET,A11-0768,PARACETAMOL 250MG,TABLET X 1000,"AUSCEL LABORATORIE S LTD PLOT 40799 SHINCO ROAD, MAI- ADIKO RAYFIELD JOS, PLATEAU STATE.","AUSCEL LABORATORIES LTD PLOT 40799 SHINCO ROAD, MAI- ADIKO RAYFIELD JOS, PLATEAU STATE. ,NIGERIA",28/06/2018,27/06/2023
42,43,AUSBETMIN TABLET,A11-0769,METFORMIN 500MG,TABLET 10 X 10,"AUSCEL LABORATORIE S LTD PLOT 40799 SHINCO ROAD, MAI- ADIKO RAYFIELD JOS, PLATEAU STATE.","AUSCEL LABORATORIES LTD PLOT 40799 SHINCO ROAD, MAI- ADIKO RAYFIELD JOS, PLATEAU STATE. ,NIGERIA",28/06/2018,27/06/2023
43,44,AUSDOL 500MGTABLE T,A11-0770,PARACETAMOL 500MG,TABLET 10 X 10,"AUSCEL LABORATORIE S LTD PLOT 40799 SHINCO ROAD, MAI- ADIKO RAYFIELD JOS, PLATEAU STATE.","AUSCEL LABORATORIES LTD PLOT 40799 SHINCO ROAD, MAI- ADIKO RAYFIELD JOS, PLATEAU STATE. ,NIGERIA",28/06/2018,27/06/2023
44,45,PEDIACOL SUSPENSION,A11-0771,SIMETHICONE 40MG,SUSPENSION 50ML,"ECOMED PHARMA LTD PLOT 32, LYNSON CHEMICAL AVENUE,KM. 32 LAGOS ABEOKUTA EXPRESSWAY SANGO OTA, OGUN STATE.","ECOMED PHARMA LTD PLOT 32, LYNSON CHEMICAL AVENUE,KM. 32 LAGOS ABEOKUTA EXPRESSWAY SANGO OTA, OGUN STATE. ,NIGERIA",28/06/2018,27/06/2023
45,46,ANNACLOX DROPS,A11-0772,"AMPICILIN 60MG, CLOXACILLIN 30MG",SUSPENSION 8ML,"JAWA INTERNATIONA L LIMITED PLOT 6,ABIMBOLA WAY, ISOLO INDUSTRIAL ESTATE, ISOLO, LAGOS STATE","JAWA INTERNATIONAL LIMITED PLOT 6,ABIMBOLA WAY, ISOLO INDUSTRIAL ESTATE, ISOLO, LAGOS STATE ,NIGERIA",28/06/2018,27/06/2023
46,47,ANNMOX DROPS,A11-0773,AMOXICILLIN TRYHYDRATE 100MG,SUSPENSION 10ML,"JAWA INTERNATIONA L LIMITED PLOT 6,ABIMBOLA WAY, ISOLO INDUSTRIAL ESTATE, ISOLO, LAGOS STATE","JAWA INTERNATIONAL LIMITED PLOT 6,ABIMBOLA WAY, ISOLO INDUSTRIAL ESTATE, ISOLO, LAGOS STATE ,NIGERIA",28/06/2018,27/06/2023
47,48,BISOPROLOL TABLET,A11-0774,BISOPROLOL 2.5MG,TABLET 2 X 14,"ECOMED PHARMA LTD PLOT 32, LYNSON CHEMICAL AVENUE,KM. 32 LAGOS ABEOKUTA EXPRESSWAY SANGO OTA, OGUN STATE.","ECOMED PHARMA LTD PLOT 32, LYNSON CHEMICAL AVENUE,KM. 32 LAGOS ABEOKUTA EXPRESSWAY SANGO OTA, OGUN STATE. ,NIGERIA",28/06/2018,27/06/2023
48,49,AUSCEL DICLOFENAC TABLET,A11-0775,DICLOFENAC SODIUM 100MG,TABLET 1 X 10,"AUSCEL LABORATORIE S LTD PLOT 40799 SHINCO ROAD, MAI- ADIKO RAYFIELD JOS, PLATEAU STATE.","AUSCEL LABORATORIES LTD PLOT 40799 SHINCO ROAD, MAI- ADIKO RAYFIELD JOS, PLATEAU STATE. ,NIGERIA",28/06/2018,27/06/2023
49,50,CHEMOGLOB IN SYRUP,A11-0776,"HEAMOGLOBIN POWDER 500MG,CYANOCO BALAMIN(VITB12) 0.02MG(20MCG),M ALT EXTRACT 100MG",SYRUP 200ML,"CHEMO- PHARMA LABORATORIE S LTD 13, OLANREWAJU STREEET, OREGUN INDUSTRIAL ESTATE, LAGOS STATE","CHEMO-PHARMA LABORATORIES LTD 13, OLANREWAJU STREEET, OREGUN INDUSTRIAL ESTATE, LAGOS STATE ,NIGERIA",28/06/2018,27/06/2023
50,51,VAMIREX SYRUP,A11-0777,"PARACETAMOL 125MG, PROMETHAZINE HCL 3MG",SYRUP 60ML,"TUYIL PHARM IND.LIMITED 22,NEW YIDI ROAD, ILORIN. KWARA STATE, NIGERIA","TUYIL PHARM IND.LIMITED 22,NEW YIDI ROAD, ILORIN. KWARA STATE, NIGERIA ,NIGERIA",28/06/2018,27/06/2023
51,52,VAMAFED TABLET,A11-0778,CHLORPHENIRAM INE MALEATE 4MG,TABLET X100,"TUYIL PHARM IND.LIMITED 22,NEW YIDI ROAD, ILORIN. KWARA STATE, NIGERIA","TUYIL PHARM IND.LIMITED 22,NEW YIDI ROAD, ILORIN. KWARA STATE, NIGERIA ,NIGERIA",28/06/2018,27/06/2023
52,53,BEENIE BALM,A11-0780,"MENTHOL 1.66% W/W, CAMPHOR 10.00%W/W, METHYL SALICYLATE 0.66%W/W, EUCALYPTUS OIL 0.66% W/W, PUMILO PINE OIL 0.66%W/W, TITANIUM DIOXIDE 0.06%W/W, SOFT PARAFFIN 100%W/W","TOPICAL CREAM X 4G, 27G","BEENIE INDUSTRIES LIMITED GEZAWA ROAD, TSAMIYA BABBA, KANO STATE","BEENIE INDUSTRIES LIMITED GEZAWA ROAD, TSAMIYA BABBA, KANO STATE ,NIGERIA",28/06/2018,27/06/2023
53,54,HOME PRIDE ANTISEPTIC DISINFECTA NT,A11-0781,CHLOROXYLENO L 5 % PINE OIL 2 %,"LIQUID, X 200ML","NAJAL GLOBAL CO. LTD 116, ZIK AVENUE, UWANI ENUGU STATE","APACCO PHARMA NIG. LTD 15/16 OYAKANMI STREET, OLORI AKUTE, OGUN STATE ,NIGERIA",28/06/2018,27/06/2023
54,55,HICLOFLEX TABLET,A11-0782,ORPHENADRINE CITRATE 100MG,TABLET X 100,"HIGH CLOUT PHARMA LTD 3 ENIOLA STREET, OFF OLANIYI STREET, IDIORO, LAGOS STATE.","ECOMED PHARMA LTD PLOT 32, LYNSON CHEMICAL AVENUE,KM. 32 LAGOS ABEOKUTA EXPRESSWAY SANGO OTA, OGUN STATE. ,NIGERIA",28/06/2018,27/06/2023
55,56,SINUFED,A11-0783,"TRIPOLIDONE 2.5 MG, PSEUDOEPHEDRI NE 60MG",CAPSULES X 10 X 10,"SKG-PHARMA LIMITED 7/9 SAPARA STREET, IKEJA LAGOS STATE","SKG-PHARMA LIMITED 7/9 SAPARA STREET, IKEJA LAGOS STATE ,NIGERIA",28/06/2018,27/06/2023
56,57,BROMEX PLUS COUGH SYRUP,A11-0784,"BROMHEXINE HYDROCHLORIDE 8MG, DEXTROMETHOR PHAN HYDROBROMIDE 10MG, AMMONIUM CHLORIDE 100MG, MENTHOL 5MG",SYRUP X 100ML,"REALS PHARMACEUTI CAL LTD PLOT 1, JUNAID DOSUNMU STREE, CENTRAL BUSINESS DISTRICT, ALAUSA, IKEJA, LAGOS STATE","RAJRAB LTD 72-80 COCA-COLA ROAD, INDUSTRIAL ESTATE, ILORIN, KWARA STATE ,NIGERIA",28/06/2018,27/06/2023
57,58,CHLORAMPH ENICOL EYE DROPS,A11-0232,CHLORAMPHENIC OL 0.5%,"LIQUID, X 10ML","FIDSON HEALTHCARE PLC KM. 38, LAGOS- ABEOKUTA EXPRESSWAY, SANGO OTA, OGUN STATE.","FIDSON HEALTHCARE PLC KM. 38, LAGOS- ABEOKUTA EXPRESSWAY, SANGO OTA, OGUN STATE. ,NIGERIA",28/06/2018,27/06/2023
58,59,ARDEMAG OMEPRAZOL E CAPSULES,A11-0785,OMEPRAZOLE 20MG,CAPSULES 2 X 10,"AVRO PHARMA LTD DAID HOUSE, PLOT 2, BLOCK J LIMCA WAY, ISOLO INDUSTRIAL ESTATE ESTATE, OSHODI-APAPA EXPRESSWAY, ISOLO, LAGOS STATE.","SKG-PHARMA LIMITED 7/9 SAPARA STREET, IKEJA LAGOS STATE ,NIGERIA",28/06/2018,27/06/2023
59,60,AVRO CIPRO CAPLETS,A11-0786,CIPROFLOXACIN 500MG,CAPLET 1 X 10,"AVRO PHARMA LTD DAID HOUSE, PLOT 2, BLOCK J LIMCA WAY, ISOLO INDUSTRIAL ESTATE ESTATE, OSHODI-APAPA EXPRESSWAY, ISOLO, LAGOS STATE.","SKG-PHARMA LIMITED 7/9 SAPARA STREET, IKEJA LAGOS STATE ,NIGERIA",28/06/2018,27/06/2023
60,61,ALDAZ ORAL SUSPENSION,A11-0584,ALBENDAZOLE 200MG/5ML,SUSPENSION X 10ML,"REALS PHARMACEUTI CAL LTD PLOT 1, JUNAID DOSUNMU STREE, CENTRAL BUSINESS DISTRICT, ALAUSA, IKEJA, LAGOS","RAJRAB LTD 72-80 COCA-COLA ROAD, INDUSTRIAL ESTATE, ILORIN, KWARA STATE ,NIGERIA",28/06/2018,27/06/2023
61,62,SKG LOSARTAN TABLET,A11-0792,LOSARTAN POTASSIUM 50MG,"TABLET, 3 X 10","SKG PHARMA LTD 7/9 SAPARA STREET, IKEJA, LAGOS STATE","SKG PHARMA LTD 7/9 SAPARA STREET, IKEJA, LAGOS STATE ,NIGERIA",28/06/2018,27/06/2023
62,63,BECOVIT SYRUP,A11-0793,"VITAMIN B1 5MG, VITAMIN B2 2MG, VITAMIN B6 2MG, NICOTINAMIDE 20MG/ 5ML","SYRUP, X 100ML","UNIQUE PHARM LTD KM 38 ABEOKUTA ROAD, SANGO- OTA, OGUN STATE","UNIQUE PHARM LTD KM 38 ABEOKUTA ROAD, SANGO-OTA, OGUN STATE ,NIGERIA",28/06/2018,27/06/2023
63,64,SEEBEST CIPROFLOXA CIN TABLET,A11-0794,CIPROFLOXACIN 500MG,"TABLET, X 10","SEEBEST PHARMA CHEMISTS LTD KM 3, NKPOR- UMUOJI ROAD, NKPOR ANAMBRA STATE","SEEBEST PHARMA CHEMISTS LTD KM 3, NKPOR-UMUOJI ROAD, NKPOR ANAMBRA STATE ,NIGERIA",28/06/2018,27/06/2023
64,65,FAITH VITAMIN C DROPS,A11-0795,ASCORBIC ACID 100MG/ ML,"DROPS, X 15ML","OAK-FAITH PHARMACEUTI CAL RESOURCE LTD 10-12 JALOGUN PALACE WAY, OFF KM. 44, LAGOS-IBADAN EXPRESS WAY, IMEDU-NLA, MOWE OGUN STATE.","OAK-FAITH PHARMACEUTICAL RESOURCE LTD 10- 12 JALOGUN PALACE WAY, OFF KM. 44, LAGOS- IBADAN EXPRESS WAY, IMEDU-NLA, MOWE OGUN STATE. ,NIGERIA",28/06/2018,27/06/2023
65,66,GAUZE MULTIVITA MIN TABLET,A11-0796,"VITAMIN A 2500IU, VITAMIN D 250IU, VITAMIN C 13000MCG, VITAMIN B1 600MCG","TABLET, X 1000","GAUZE PHARM & LAB LTD ENU-IFITE VILLAGE, AWKA, ANAMBRA STATE","GAUZE PHARM & LAB LTD ENU-IFITE VILLAGE, AWKA, ANAMBRA STATE ,NIGERIA",28/06/2018,27/06/2023
66,67,GAUZE YEAST TABLET,A11-0797,YEAST 300MG,"TABLET, X 1000, X 100","GAUZE PHARM & LAB LTD ENU-IFITE VILLAGE, AWKA, ANAMBRA STATE","GAUZE PHARM & LAB LTD ENU-IFITE VILLAGE, AWKA, ANAMBRA STATE ,NIGERIA",28/06/2018,27/06/2023
67,68,GAUZE VITAMIN B COMPLEX TABLET,A11-0798,"VITAMIN B1 1MG, VITAMIN B2 1MG, NICOTINAMIDE 15MG","TABLET, X 1000","GAUZE PHARM & LAB LTD ENU-IFITE VILLAGE, AWKA, ANAMBRA STATE","GAUZE PHARM & LAB LTD ENU-IFITE VILLAGE, AWKA, ANAMBRA STATE ,NIGERIA",28/06/2018,27/06/2023
68,69,GAUZE FOLIC ACID TABLET,A11-0799,FOLIC ACCID 5MG,"TABLET, X 1000, X 100","GAUZE PHARM & LAB LTD ENU-IFITE VILLAGE, AWKA, ANAMBRA STATE","GAUZE PHARM & LAB LTD ENU-IFITE VILLAGE, AWKA, ANAMBRA STATE ,NIGERIA",28/06/2018,27/06/2023
69,70,GAUZE CHLORPHENI RAMINE MALEATE TABLET,A11-0800,CHLORPHENIRAM INE MALEATE 4MG,"TABLET, X 1000","GAUZE PHARM & LAB LTD ENU-IFITE VILLAGE, AWKA, ANAMBRA STATE","GAUZE PHARM & LAB LTD ENU-IFITE VILLAGE, AWKA, ANAMBRA STATE ,NIGERIA",28/06/2018,27/06/2023
70,71,CHIARA CREAM,A11-0801,CLOBESTEROL PROPIONATE 0.05% W/W,CREAM 30G,"OZAH CHEMICALS & PHARM LTD 10/12, BAYO OYEGBEMI STREET, EGBEDA LAGOS STATE","OZAH CHEMICALS & PHARM LTD 10/12, BAYO OYEGBEMI STREET, EGBEDA LAGOS STATE ,NIGERIA",28/06/2018,27/06/2023
71,72,CHIARA CREAM (LEMON FRAGRANCE),A11-0802,CLOBESTEROL PROPIONATE 0.05% W/W,"CREAM, X 30G","OZAH CHEMICALS & PHARM LTD 10/12, BAYO OYEGBEMI STREET, EGBEDA LAGOS STATE","OZAH CHEMICALS & PHARM LTD 10/12, BAYO OYEGBEMI STREET, EGBEDA LAGOS STATE ,NIGERIA",28/06/2018,27/06/2023
72,73,MOXIE PARACETAM OL SUSPENSION,A11-0803,PARACETAMOL 120MG /5ML,"SUSPENSION, X 100ML","ROCKFORTH LIMITED 28, AKINSANYA STREET, OJODU, LAGOS STATE","OAK-FAITH PHARMACEUTICAL RESOURCES LTD. 10- 12 JALOGUN PALACE WAY, OFF KM. 44, LAGOS- IBADAN EXPRESS WAY, IMEDU-NLA, MOWE OGUN STATE. ,NIGERIA",28/06/2018,27/06/2023
73,74,MOXIE VITAMIN-C SYRUP,A11-0804,ASCORBIC ACID 100MG /5ML,"SYRUP, X 100ML","ROCKFORTH LIMITED 28, AKINSANYA STREET, OJODU, LAGOS STATE","OAK-FAITH PHARMACEUTICAL RESOURCES LTD. 10- 12 JALOGUN PALACE WAY, OFF KM. 44, LAGOS- IBADAN EXPRESS WAY, IMEDU-NLA, MOWE OGUN STATE. ,NIGERIA",28/06/2018,27/06/2023
74,75,STERLIN CHLORPHENI RAMINE MALEATE SYRUP,A11-0805,CHLORPHENIRAM INE MALEATE 2MG /5ML,"SYRUP, X 60ML","STERLING DRUGS LTD 5 FEMI ASIWAJU CLOSE, OJODU ESTATE, OJODU, LAGOS STATE","ECOMED PHARM LTD PLOT 32 LYNSON CHEMICAL AVENUE, KM 38 LAGOS-ABEOKUTA EXPRESSWAY, SANGO-OTA, OGUN STATE ,NIGERIA",28/06/2018,27/06/2023
75,76,BOUCIA'S OMEPRAZOL E CAPSULE,A11-0669,OMEPRAZOLE 20MG,"CAPSULE, 10 X 10","BOUCIA LTD 1 SERAH AROBIEKE STREET, AMUWO- ODOFIN, LAGOS STATE","ECOMED PHARM LTD PLOT 32 LYNSON CHEMICAL AVENUE, KM 38 LAGOS-ABEOKUTA EXPRESSWAY, SANGO-OTA, OGUN STATE ,NIGERIA",14/06/2018,13/06/2023
76,77,GARYLYTE ORAL REHYDRATI ON SALT (ORANGE FLAVOUR),A11-0670,"DEXTROSE 13.5G, SODIUM CHLORIDE 2.6G,SODIUM CITRATE 2.9G, POTASSIUM CHLORIDE 1.5G,","POWDER FOR SOLUTION, 3 X 20.5G","AGARY PHARM LTD PLOT C39A AMUWO ODOFIN COMMERCIAL SCHEME, AMUWO ODOFIN, LAGOS STATE","AGARY PHARM LTD PLOT C39A AMUWO ODOFIN COMMERCIAL SCHEME, AMUWO ODOFIN, LAGOS STATE ,NIGERIA",14/06/2018,13/06/2023
77,78,AREACTIN TABLET,A11-0208,CHLORPHENIRAM INE MALEATE 4MG,"TABLET, 10 X 10","PHAMATEX INDUSTRIES LIMITED MARBLE HOUSE, 1 CRYSTAL GLASS CLOSE, AMUWO ODOFIN INDUSTRIAL ESTATE, LAGOS","PHAMATEX INDUSTRIES LIMITED MARBLE HOUSE, 1 CRYSTAL GLASS CLOSE, AMUWO ODOFIN INDUSTRIAL ESTATE, LAGOS ,",25/08/2016,24/08/2021
78,79,SOFAQUINE SYRUP,A11-0249,CHLOROQUINE PHOSPHATE (EQUIVALENT TO 50MG CLOROQUINE BASE) 80MG/ 5ML,"SYRUP, X 60ML","SOFAK PHARM IND LTD KLM 6 ILORIN ROAD, OGBOMOSHO, OYO STATE","SOFAK PHARM IND LTD KLM 6 ILORIN ROAD, OGBOMOSHO, OYO STATE ,",25/08/2016,24/08/2021
79,80,AVRO GRIPE WATER,A11-0250,"TERPENELESS DILL SEED OIL 2.14MG, SODIUM BICARBONATE 50MG, GINGER TINCTURE 0.368,L/ 5ML","SOLUTION, X 100ML","AVRO PHARMA LTD, PLOT 2, BLOCK J, LIMCA WAY, ISOLO INDUSTRIAL ESTATE, ISOLO, LAGOS","SKG PHARMA LTD 7/9 SAPARA STREET, IKEJA, LAGOS ,",25/08/2016,24/08/2021
80,81,SOFAMAG SUSPENSION,A11-0251,"MAGNESIUM TRISILICATE 250MG, LIGHT MAGNESIUM CARBONATE 250MG, SODIUM BICARBONATE 250MG/ 5ML","SUSPENSION, X 200ML","SOFAK PHARM IND LTD KLM 6 ILORIN ROAD, OGBOMOSHO, OYO STATE","SOFAK PHARM IND LTD KLM 6 ILORIN ROAD, OGBOMOSHO, OYO STATE ,",25/08/2016,24/08/2021
81,82,BLOOM VITE MULTIVITA MIN SYRUP,A11-0268,"VITAMIN A 1000 IU, VITAMIN B1 1500MCG, VITAMIN B2 1500MCG, VITAMIN B12 2500NG, VITAMIN C 50MG, VITAMIN D 200IU, NICOTINAMIDE 10MG","SYRUP, X100ML","BIOPHARMA NIGERIA LIMITED 10 PALACE RD., ODOGUNYAN, IKORODU, LAGOS","BIOPHARMA NIGERIA LIMITED 10 PALACE RD., ODOGUNYAN, IKORODU, LAGOS ,",05/10/2016,04/10/2021
82,83,MONOMIN PLUS SYRUP,A11-0276,"VITAMIN B1 3MG, VITAMIN B2 2MG, VITAMIN B6 5MG, VITAMIN B12 5MCG, VITAMIN B5 3MG VITAMIN D 100I.U, COD LIVER OIL 7.5MG","SYRUP, X 200ML","TUYIL PHARM. IND. LIMITED 22, NEW YIDI ROAD, ILORIN","TUYIL PHARM. IND. LIMITED 22, NEW YIDI ROAD, ILORIN ,",05/10/2016,04/10/2021
83,84,LEYCEE VITAMIN C SYRUP,A11-0271,ASCORBIC ACID 100MG/5ML,"SYRUP, X100ML","LEYJAY NIGERIA LIMITED INDUSTRIAL LAYOUT ROAD, BEHIND DZUMA BLOCK INDUSTRY, SAUKA KAHUTA AREA, MINNA, NIGER STATE","LEYJAY NIGERIA LIMITED INDUSTRIAL LAYOUT ROAD, BEHIND DZUMA BLOCK INDUSTRY, SAUKA KAHUTA AREA, MINNA, NIGER STATE ,",05/10/2016,04/10/2021
84,85,TOP-CEE 500 CHEWABLE TABLETS,A11-0255,ASCORBIC ACID 500MG,"CAPLET, 3 X 10","NEMEL PHARMACEUTI CAL NIGERIA LIMITED PLOT 35, EMENE INDUSTRIAL LAYOUT, ENUGU","NEMEL PHARMACEUTICAL NIGERIA LIMITED PLOT 35, EMENE INDUSTRIAL LAYOUT, ENUGU ,",05/10/2016,04/10/2021
85,86,TOP-CEE 500 NON CHEWABLE TABLETS,A11-0254,ASCORBIC ACID 500MG,"TABLET, 3 X 10","NEMEL PHARMACEUTI CAL NIGERIA LIMITED PLOT 35, EMENE INDUSTRIAL LAYOUT, ENUGU","NEMEL PHARMACEUTICAL NIGERIA LIMITED PLOT 35, EMENE INDUSTRIAL LAYOUT, ENUGU ,",05/10/2016,04/10/2021
